Date,Sequential_Number,Mitzvah_Type_Number,Summary,Biblical_Source,Sefaria_Link
2026-03-22,235,Positive 221,We are commanded about the law of the [captive woman of] beautiful form.,Bamidbar 6:3,https://www.sefaria.org/Sefer_HaMitzvot%2C_Positive_Commandments.221?lang=bi
2026-03-22,236,Positive 222,We are commanded - if one wants to divorce to divorce with a contract under all circumstances.,Bamidbar 6:4,https://www.sefaria.org/Sefer_HaMitzvot%2C_Positive_Commandments.222?lang=bi
2026-03-23,237,Positive 223,He must not eat grape skins,Bamidbar 6:4,https://www.sefaria.org/Sefer_HaMitzvot%2C_Positive_Commandments.223?lang=bi
2026-03-23,238,Positive 224,We are commanded to give lashes with a whip to those that transgress certain commandments.,Bamidbar 6:6,https://www.sefaria.org/Sefer_HaMitzvot%2C_Positive_Commandments.224?lang=bi
2026-03-24,239,Positive 225,We are commanded to remove an accidental killer from his city to a city of refuge.,Bamidbar 6:7,https://www.sefaria.org/Sefer_HaMitzvot%2C_Positive_Commandments.225?lang=bi
2026-03-24,240,Positive 226,"We are commanded to kill, with a sword, those that transgress certain commandments.",Bamidbar 6:18,https://www.sefaria.org/Sefer_HaMitzvot%2C_Positive_Commandments.226?lang=bi
2026-03-25,241,Positive 227,We are commanded to strangle those that transgress certain commandments.,Vayikra 27:2,https://www.sefaria.org/Sefer_HaMitzvot%2C_Positive_Commandments.227?lang=bi
2026-03-25,242,Positive 228,We are commanded to immolate those that transgress certain commandments.,Vayikra 27:12-13,https://www.sefaria.org/Sefer_HaMitzvot%2C_Positive_Commandments.228?lang=bi
2026-03-26,243,Positive 229,We are commanded to stone those that transgress certain commandments.,Vayikra 27:14,https://www.sefaria.org/Sefer_HaMitzvot%2C_Positive_Commandments.229?lang=bi
2026-03-26,244,Positive 230,We are commanded to hang some of those killed by the court.,Vayikra 27:16,https://www.sefaria.org/Sefer_HaMitzvot%2C_Positive_Commandments.230?lang=bi
2026-03-27,245,Positive 231,We are commanded to bury those killed by the court on the day that they are killed.,Vayikra 27:28,https://www.sefaria.org/Sefer_HaMitzvot%2C_Positive_Commandments.231?lang=bi
2026-03-27,246,Positive 232,We are commanded in this positive mitzvah.,Vayikra 27:28,https://www.sefaria.org/Sefer_HaMitzvot%2C_Positive_Commandments.232?lang=bi
2026-03-28,247,Positive 233,We are commanded that the master who acquired a Hebrew (Jewish) maidservant marry her [he] or his son.,Vayikra 27:28,https://www.sefaria.org/Sefer_HaMitzvot%2C_Positive_Commandments.233?lang=bi
2026-03-28,248,Positive 234,We are commanded to redeem the Hebrew maidservant.,Vayikra 19:19,https://www.sefaria.org/Sefer_HaMitzvot%2C_Positive_Commandments.234?lang=bi
2026-03-29,249,Positive 235,We are commanded about the law of the Canaanite (gentile) slave.,Devarim 22:9,https://www.sefaria.org/Sefer_HaMitzvot%2C_Positive_Commandments.235?lang=bi
2026-03-29,250,Positive 236,We are commanded about the law of one who injures his fellow.,Vayikra 19:19,https://www.sefaria.org/Sefer_HaMitzvot%2C_Positive_Commandments.236?lang=bi
2026-03-30,251,Positive 237,We are commanded to administer the laws of the ox [that causes damage].,Devarim 22:10,https://www.sefaria.org/Sefer_HaMitzvot%2C_Positive_Commandments.237?lang=bi
2026-03-30,252,Positive 238,We are commanded to administer the laws of the pit [that causes damage].,Devarim 22:11,https://www.sefaria.org/Sefer_HaMitzvot%2C_Positive_Commandments.238?lang=bi
2026-03-31,253,Positive 239,"We are commanded to administer the laws of the thief that we fine him with the law of double-payment or four or five times, we kill him if he comes surreptitiously, we sell him and all of the regulations of the thief more generally, as explained in Scripture.",Vayikra 19:10,https://www.sefaria.org/Sefer_HaMitzvot%2C_Positive_Commandments.239?lang=bi
2026-03-31,254,Positive 240,We are commanded about the law of grazing.,Vayikra 19:9,https://www.sefaria.org/Sefer_HaMitzvot%2C_Positive_Commandments.240?lang=bi
2026-04-01,255,Positive 241,We are commanded about the law of fire damage.,Vayikra 19:9,https://www.sefaria.org/Sefer_HaMitzvot%2C_Positive_Commandments.241?lang=bi
2026-04-01,256,Positive 242,We are commanded about the law of the unpaid guardian.,Vayikra 19:9,https://www.sefaria.org/Sefer_HaMitzvot%2C_Positive_Commandments.242?lang=bi
2026-04-02,257,Positive 243,"We are commanded about the law of the [paid guardian] and the renter since the law of the two of them is the same, as they explained and said (Shevuot 49b), ""There are three laws for four [categories of] guardians.",Vayikra 19:10,https://www.sefaria.org/Sefer_HaMitzvot%2C_Positive_Commandments.243?lang=bi
2026-04-02,258,Positive 244,We are commanded about the law of the borrower.,Vayikra 19:10,https://www.sefaria.org/Sefer_HaMitzvot%2C_Positive_Commandments.244?lang=bi
2026-04-03,259,Positive 245,We are commanded about the law of buying and selling meaning the ways in which the sale between the seller and buyer is effectuated.,Vayikra 19:10,https://www.sefaria.org/Sefer_HaMitzvot%2C_Positive_Commandments.245?lang=bi
2026-04-03,260,Positive 246,We are commanded about the law of claimant and defendant.,Vayikra 19:10,https://www.sefaria.org/Sefer_HaMitzvot%2C_Positive_Commandments.246?lang=bi
2026-04-04,261,Positive 247,To leave the forgotten sheaves in the field for the poor,Devarim 24:19,https://www.sefaria.org/Sefer_HaMitzvot%2C_Positive_Commandments.247?lang=bi
2026-04-04,262,Positive 248,We are commanded in this positive mitzvah.,Devarim 24:19,https://www.sefaria.org/Sefer_HaMitzvot%2C_Positive_Commandments.248?lang=bi
2026-04-05,263,Conclusion,The positive commandments have been completed.,,https://www.sefaria.org/Sefer_HaMitzvot%2C_Conclusion_for_Positive_Commandments?lang=bi
2026-04-05,264,Negative 1,We are prohibited from believing in a god besides Him.,Devarim 14:28,https://www.sefaria.org/Sefer_HaMitzvot%2C_Negative_Commandments.1?lang=bi
2026-04-06,265,Negative 2,We are prohibited from making an idol to serve and there is no difference whether one made it with his hands or commanded that it be made.,Devarim 15:11,https://www.sefaria.org/Sefer_HaMitzvot%2C_Negative_Commandments.2?lang=bi
2026-04-06,266,Negative 3,"We are prohibited from making an idol for those besides us, in order that they serve it and even if the one who commanded [us] to make it was a gentile.",Devarim 15:7,https://www.sefaria.org/Sefer_HaMitzvot%2C_Negative_Commandments.3?lang=bi
2026-04-07,267,Negative 4,"We are prohibited from making images from wood, stones, metal and other [substances] and even though they are not made to worship.",Devarim 18:4,https://www.sefaria.org/Sefer_HaMitzvot%2C_Negative_Commandments.4?lang=bi
2026-04-07,268,Negative 5,We are prohibited from bowing to an idol.,Bamidbar 18:26,https://www.sefaria.org/Sefer_HaMitzvot%2C_Negative_Commandments.5?lang=bi
2026-04-08,269,Negative 6,"Not to improperly preface one tithe to the next, but separate them in their proper order",Shemos 22:28,https://www.sefaria.org/Sefer_HaMitzvot%2C_Negative_Commandments.6?lang=bi
2026-04-08,270,Negative 7,"We are prohibited from giving over some of our children to that object of worship that was famous at the time of the giving of the Torah, the name of which was Molekh.",Vayikra 22:10,https://www.sefaria.org/Sefer_HaMitzvot%2C_Negative_Commandments.7?lang=bi
2026-04-09,271,Negative 8,We are prohibited from making an <i>ov</i> and that is that one burn a certain incense and do specific acts and it appears to him that he hears speech from below his underarm that answers what he asks it.,Vayikra 22:10,https://www.sefaria.org/Sefer_HaMitzvot%2C_Negative_Commandments.8?lang=bi
2026-04-09,272,Negative 9,We are prohibited from doing the procedure of the <i>yidaoni</i> and this too is one of the types of idolatry.,Shemos 12:48,https://www.sefaria.org/Sefer_HaMitzvot%2C_Negative_Commandments.9?lang=bi
2026-04-10,273,Negative 10,"We are prohibited from inclining towards idolatry and occupying ourselves with its narratives meaning to say, into this study of spirituality.",Vayikra 22:4,https://www.sefaria.org/Sefer_HaMitzvot%2C_Negative_Commandments.10?lang=bi
2026-04-10,274,Negative 11,"We are prohibited from making a pillar to which we attach ourselves and honor, even if it positioned to serve G-d upon it.",Vayikra 22:12,https://www.sefaria.org/Sefer_HaMitzvot%2C_Negative_Commandments.11?lang=bi
2026-04-11,275,Negative 12,"We are prohibited from making a stone that is designed to bowing upon, even if this was for [bowing to] G-d, may He be blessed.",Bamidbar 18:24,https://www.sefaria.org/Sefer_HaMitzvot%2C_Negative_Commandments.12?lang=bi
2026-04-11,276,Negative 13,We are prohibited from idolatry.,Devarim 14:22,https://www.sefaria.org/Sefer_HaMitzvot%2C_Negative_Commandments.13?lang=bi
2026-04-12,277,Negative 14,We are prohibited from swearing by an idol.,Devarim 26:14,https://www.sefaria.org/Sefer_HaMitzvot%2C_Negative_Commandments.14?lang=bi
2026-04-12,278,Negative 15,"We are prohibited from preaching for an idol, and [for one] to call people to serve it and to make them enthused about it and even if the preacher does not do any of the actions [of idolatry] besides preaching about it.",Devarim 26:14,https://www.sefaria.org/Sefer_HaMitzvot%2C_Negative_Commandments.15?lang=bi
2026-04-13,279,Negative 16,We are prohibited from inciting.,Devarim 26:14,https://www.sefaria.org/Sefer_HaMitzvot%2C_Negative_Commandments.16?lang=bi
2026-04-13,280,Negative 17,Not to eat Second Tithe grains outside Jerusalem,Devarim 12:17,https://www.sefaria.org/Sefer_HaMitzvot%2C_Negative_Commandments.17?lang=bi
2026-04-14,281,Negative 18,Not to eat Second Tithe wine products outside Jerusalem,Devarim 12:17,https://www.sefaria.org/Sefer_HaMitzvot%2C_Negative_Commandments.18?lang=bi
2026-04-14,282,Negative 19,Not to eat Second Tithe oil outside Jerusalem,Devarim 12:17,https://www.sefaria.org/Sefer_HaMitzvot%2C_Negative_Commandments.19?lang=bi
2026-04-15,283,Negative 20,We are prohibited from an incited one from arguing the merit of the inciter.,Vayikra 19:24,https://www.sefaria.org/Sefer_HaMitzvot%2C_Negative_Commandments.20?lang=bi
2026-04-15,284,Negative 21,We are prohibited from an incited one from being silent about something incriminating that he knows about the inciter that will bring about the punishment upon him.,Devarim 26:13,https://www.sefaria.org/Sefer_HaMitzvot%2C_Negative_Commandments.21?lang=bi
2026-04-16,285,Negative 22,We are prohibited from benefiting from the ornaments with which an idol is decorated.,Shemos 23:19,https://www.sefaria.org/Sefer_HaMitzvot%2C_Negative_Commandments.22?lang=bi
2026-04-16,286,Negative 23,The Kohanim must not eat the first fruits outside Jerusalem,Devarim 12:17,https://www.sefaria.org/Sefer_HaMitzvot%2C_Negative_Commandments.23?lang=bi
2026-04-17,287,Negative 24,"We are prohibited from we not benefit from, or at all hold on to, wealth from a condemned city.",Devarim 26:5,https://www.sefaria.org/Sefer_HaMitzvot%2C_Negative_Commandments.24?lang=bi
2026-04-17,288,Negative 25,We are prohibited from attaching something from an idol to our wealth.,Bamidbar 15:20,https://www.sefaria.org/Sefer_HaMitzvot%2C_Negative_Commandments.25?lang=bi
2026-04-18,289,Negative 26,"To give the shoulder, two cheeks, and stomach of slaughtered animals to a Kohen",Devarim 18:3,https://www.sefaria.org/Sefer_HaMitzvot%2C_Negative_Commandments.26?lang=bi
2026-04-18,290,Negative 27,To give the first shearing of sheep to a Kohen,Devarim 18:4,https://www.sefaria.org/Sefer_HaMitzvot%2C_Negative_Commandments.27?lang=bi
2026-04-19,291,Negative 28,We are prohibited from listening to one who prophesies in the name of an idol.,Bamidbar 18:15,https://www.sefaria.org/Sefer_HaMitzvot%2C_Negative_Commandments.28?lang=bi
2026-04-19,292,Negative 29,"We are prohibited from we not be afraid of the false prophet, nor be negligent about killing him, because he prophesied in the name of G-d.",Shemos 13:13,https://www.sefaria.org/Sefer_HaMitzvot%2C_Negative_Commandments.29?lang=bi
2026-04-20,293,Negative 30,"We are prohibited from following in the ways of the idolaters, and from behaving according to their practices and even with their clothing and with their gatherings in their assemblies.",Shemos 13:13,https://www.sefaria.org/Sefer_HaMitzvot%2C_Negative_Commandments.30?lang=bi
2026-04-20,294,Negative 31,"We are prohibited from divination meaning to say, that one moves the faculty of imagination with a type of stimulus, like all of those with abilities to say what will happen before it does.",Shemos 34:21,https://www.sefaria.org/Sefer_HaMitzvot%2C_Negative_Commandments.31?lang=bi
2026-04-21,295,Negative 32,We are prohibited from doing actions chosen by astrology.,Vayikra 25:4,https://www.sefaria.org/Sefer_HaMitzvot%2C_Negative_Commandments.32?lang=bi
2026-04-21,296,Negative 33,"We are prohibited from soothsaying, such as the statement of the empty ones ""I have already returned from the path, I will not finish all that I need""; ""Today is Sunday, I will not benefit anything from having seen thing x.",Vayikra 25:4,https://www.sefaria.org/Sefer_HaMitzvot%2C_Negative_Commandments.33?lang=bi
2026-04-22,297,Negative 34,We are prohibited from witchcraft entirely.,Vayikra 25:5,https://www.sefaria.org/Sefer_HaMitzvot%2C_Negative_Commandments.34?lang=bi
2026-04-22,298,Negative 35,We are prohibited from being a charmer and that is saying things that they think will be effective for this.,Vayikra 25:5,https://www.sefaria.org/Sefer_HaMitzvot%2C_Negative_Commandments.35?lang=bi
2026-04-23,299,Negative 36,We are prohibited from inquiring of someone with an <i>ov</i>.,Shemos 23:11,https://www.sefaria.org/Sefer_HaMitzvot%2C_Negative_Commandments.36?lang=bi
2026-04-23,300,Negative 37,We are prohibited from inquiring of a <i>yidaoni</i>.,Devarim 15:3,https://www.sefaria.org/Sefer_HaMitzvot%2C_Negative_Commandments.37?lang=bi
2026-04-24,301,Negative 38,"We are prohibited from inquiring of the dead as is thought by those that are truly dead, even though they eat and feel and think that one who does such and dresses like this will have a dead person come to him during [his] sleep and tell him what he asks.",Devarim 15:2,https://www.sefaria.org/Sefer_HaMitzvot%2C_Negative_Commandments.38?lang=bi
2026-04-24,302,Negative 39,Not to refrain from lending immediately before the release of the loans for fear of monetary loss,Devarim 15:9,https://www.sefaria.org/Sefer_HaMitzvot%2C_Negative_Commandments.39?lang=bi
2026-04-25,303,Negative 40,We are prohibited from men adorning themselves with women's ornaments.,Vayikra 25:8,https://www.sefaria.org/Sefer_HaMitzvot%2C_Negative_Commandments.40?lang=bi
2026-04-25,304,Negative 41,"We are prohibited from inscribing colors such as blue, violet and others on our bodies, as is done by the idol worshippers.",Vayikra 25:10,https://www.sefaria.org/Sefer_HaMitzvot%2C_Negative_Commandments.41?lang=bi
2026-04-26,305,Negative 42,"We are prohibited from wearing a garment woven of wool and linen, like that which would be worn by the idolatrous priests at that time.",Vayikra 25:9,https://www.sefaria.org/Sefer_HaMitzvot%2C_Negative_Commandments.42?lang=bi
2026-04-26,306,Negative 43,We are prohibited from removing the hair of the temples.,Vayikra 25:11,https://www.sefaria.org/Sefer_HaMitzvot%2C_Negative_Commandments.43?lang=bi
2026-04-27,307,Negative 44,We are prohibited from shaving the beard and that is [specifically] five parts [of it]: The upper jaw on the right side; the lower jaw on the right side; the upper jaw on the left side; the lower jaw on the left side; and the [chin].,Vayikra 25:11,https://www.sefaria.org/Sefer_HaMitzvot%2C_Negative_Commandments.44?lang=bi
2026-04-27,308,Negative 45,We are prohibited from making cuts in our flesh for the dead.,Vayikra 25:11,https://www.sefaria.org/Sefer_HaMitzvot%2C_Negative_Commandments.45?lang=bi
2026-04-28,309,Negative 46,"We are prohibited from dwelling in the Land of Egypt forever, so that we not learn from their practices and not follow their disgraceful ways.",Vayikra 25:24,https://www.sefaria.org/Sefer_HaMitzvot%2C_Negative_Commandments.46?lang=bi
2026-04-28,310,Negative 47,We are prohibited from that we not wander after our hearts to the point that we believe doctrines that are the opposite of the doctrines that the Torah obligates us.,Vayikra 25:23,https://www.sefaria.org/Sefer_HaMitzvot%2C_Negative_Commandments.47?lang=bi
2026-04-29,311,Negative 48,"We are prohibited from making a covenant with the heretics meaning, with the seven nations (of Canaan) and to allow them to be secure.",Vayikra 25:29,https://www.sefaria.org/Sefer_HaMitzvot%2C_Negative_Commandments.48?lang=bi
2026-04-29,312,Negative 49,We are prohibited from keeping someone from the seven nations alive so that people not isolate themselves with him and he incite them to idolatry.,Devarim 18:2,https://www.sefaria.org/Sefer_HaMitzvot%2C_Negative_Commandments.49?lang=bi
2026-04-30,313,Negative 50,We are prohibited from at all pitying idolaters and from lauding anything particular to them.,Devarim 18:1,https://www.sefaria.org/Sefer_HaMitzvot%2C_Negative_Commandments.50?lang=bi
2026-04-30,314,Negative 51,"We are prohibited from settling idol worshippers in our land, so that we not learn their heresy, with His saying, ""They shall not dwell in your land lest they cause [you] to sin, etc.",Bamidbar 35:2,https://www.sefaria.org/Sefer_HaMitzvot%2C_Negative_Commandments.51?lang=bi
2026-05-01,315,Negative 52,We are prohibited from marrying heretics.,Vayikra 25:34,https://www.sefaria.org/Sefer_HaMitzvot%2C_Negative_Commandments.52?lang=bi
2026-05-01,316,Negative 53,We are prohibited from marrying Ammonites and Moabites exclusively the males even after they have entered the [Jewish] religion.,Shemos 25:8,https://www.sefaria.org/Sefer_HaMitzvot%2C_Negative_Commandments.53?lang=bi
2026-05-02,317,Negative 54,"We are prohibited from distancing the descendants of Esav after they have entered the [Jewish] religion meaning to say, we are forbidden from avoiding marriage with them.",Shemos 20:22,https://www.sefaria.org/Sefer_HaMitzvot%2C_Negative_Commandments.54?lang=bi
2026-05-02,318,Negative 55,"We are prohibited from not to distance the Egyptians and to abhor marriage to them, after they have entered the [Jewish] religion.",Shemos 20:23,https://www.sefaria.org/Sefer_HaMitzvot%2C_Negative_Commandments.55?lang=bi
2026-05-03,319,Negative 56,We are prohibited from ever making peace with Ammon and Moab.,Vayikra 19:30,https://www.sefaria.org/Sefer_HaMitzvot%2C_Negative_Commandments.56?lang=bi
2026-05-03,320,Negative 57,We are prohibited from destroying trees in order to distress its people and sadden their hearts.,Bamidbar 18:3,https://www.sefaria.org/Sefer_HaMitzvot%2C_Negative_Commandments.57?lang=bi
2026-05-04,321,Negative 58,"We are prohibited from being afraid of the enemies during the time of war, and that we not run away from them.",Bamidbar 18:5,https://www.sefaria.org/Sefer_HaMitzvot%2C_Negative_Commandments.58?lang=bi
2026-05-04,322,Negative 59,We are prohibited from forgetting that which the descendants of Amalek did to us that they were the first to hurt us.,Shemos 30:31,https://www.sefaria.org/Sefer_HaMitzvot%2C_Negative_Commandments.59?lang=bi
2026-05-05,323,Negative 60,"We are prohibited from cursing the great G-d, may He be greatly exalted from that which the secterians say.",Shemos 30:32,https://www.sefaria.org/Sefer_HaMitzvot%2C_Negative_Commandments.60?lang=bi
2026-05-05,324,Negative 61,We are prohibited from violating an oath on an utterance.,Shemos 30:32,https://www.sefaria.org/Sefer_HaMitzvot%2C_Negative_Commandments.61?lang=bi
2026-05-06,325,Negative 62,We are prohibited from we not make a vain oath.,Shemos 30:37,https://www.sefaria.org/Sefer_HaMitzvot%2C_Negative_Commandments.62?lang=bi
2026-05-06,326,Negative 63,We are prohibited from desecrating [G-d's] name.,Shemos 30:9,https://www.sefaria.org/Sefer_HaMitzvot%2C_Negative_Commandments.63?lang=bi
2026-05-07,327,Negative 64,"We are prohibited from not to test [His] assurances and threats of which His prophets have assured us, in the way of a doubt that we doubt them, once we have ascertained the truth of the prophet that is saying them.",Bamidbar 7:9,https://www.sefaria.org/Sefer_HaMitzvot%2C_Negative_Commandments.64?lang=bi
2026-05-07,328,Negative 65,"We are prohibited from smashing and destroying houses of divine service; and from destroying books of prophecy, such that we not erase the glorious names [of G-d] and that which is similar to them.",Shemos 25:15,https://www.sefaria.org/Sefer_HaMitzvot%2C_Negative_Commandments.65?lang=bi
2026-05-08,329,Negative 66,"We are prohibited from leaving one hung on a tree overnight; so that the 'blessing' of G-d not spread as a result of this, due to one's reflection when he sees it since we only hang a blasphemer and an idol worshipper.",Bamidbar 18:23,https://www.sefaria.org/Sefer_HaMitzvot%2C_Negative_Commandments.66?lang=bi
2026-05-08,330,Negative 67,No Levite must do another's work of either a Kohen or a Levite,Bamidbar 18:3,https://www.sefaria.org/Sefer_HaMitzvot%2C_Negative_Commandments.67?lang=bi
2026-05-09,331,Negative 68,"We are prohibited from he prohibited the high priest from entering the temple at any time, due to the glory of the temple and its greatness, and [that] he should be afraid and scared of the divine presence.",Vayikra 21:8,https://www.sefaria.org/Sefer_HaMitzvot%2C_Negative_Commandments.68?lang=bi
2026-05-09,332,Negative 69,"We are prohibited from a priest with a blemish to enter the temple - meaning to say the altar, between the [entrance] hall and the altar and the sanctuary.",Devarim 18:6-8,https://www.sefaria.org/Sefer_HaMitzvot%2C_Negative_Commandments.69?lang=bi
2026-05-10,333,Negative 70,We are prohibited from slaughtering an animal and its offspring on the same day.,Shemos 28:2,https://www.sefaria.org/Sefer_HaMitzvot%2C_Negative_Commandments.70?lang=bi
2026-05-10,334,Negative 71,We are prohibited from a priest with a temporary blemish - such as scurvy or a scab or that which is similar to them - to serve [in the temple] so long as he has the blemish.,Shemos 28:32,https://www.sefaria.org/Sefer_HaMitzvot%2C_Negative_Commandments.71?lang=bi
2026-05-11,335,Negative 72,We are prohibited from taking the mother bird together with the young.,Shemos 28:28,https://www.sefaria.org/Sefer_HaMitzvot%2C_Negative_Commandments.72?lang=bi
2026-05-11,336,Negative 73,A Kohen must not enter the Temple intoxicated,Vayikra 10:9,https://www.sefaria.org/Sefer_HaMitzvot%2C_Negative_Commandments.73?lang=bi
2026-05-12,337,Negative 74,We are prohibited from and scripture explains that one who transgresses this negative commandment is liable for death at the hands of the heavens.,Vayikra 10:6,https://www.sefaria.org/Sefer_HaMitzvot%2C_Negative_Commandments.74?lang=bi
2026-05-12,338,Negative 75,"We are prohibited from and in the ninth [chapter] of sanhedrin (sanhedrin 83b), they said, ""from where [do we know that] an impure priest who served is [punished] with death.",Vayikra 10:6,https://www.sefaria.org/Sefer_HaMitzvot%2C_Negative_Commandments.75?lang=bi
2026-05-13,339,Negative 76,We are prohibited from and one who transgresses this negative commandment is liable for death at the hands of the heavens.,Vayikra 16:2,https://www.sefaria.org/Sefer_HaMitzvot%2C_Negative_Commandments.76?lang=bi
2026-05-13,340,Negative 77,We are prohibited from eating a limb torn from a living animal.,Vayikra 10:7,https://www.sefaria.org/Sefer_HaMitzvot%2C_Negative_Commandments.77?lang=bi
2026-05-14,341,Negative 78,"We are prohibited from any impure person from entering the camp of the levites - and that which is similar to it for [all] the generations: the temple mount, as they explained at the beginning of tractate kelim (kelim 1:8).",Bamidbar 5:2,https://www.sefaria.org/Sefer_HaMitzvot%2C_Negative_Commandments.78?lang=bi
2026-05-14,342,Negative 79,We are prohibited from building an altar of stones that have been touched by iron.,Bamidbar 5:3,https://www.sefaria.org/Sefer_HaMitzvot%2C_Negative_Commandments.79?lang=bi
2026-05-15,343,Negative 80,"We are prohibited from ascending the altar by steps so that one not take a large step, but rather walk with the heel next to the toe.",Devarim 23:11,https://www.sefaria.org/Sefer_HaMitzvot%2C_Negative_Commandments.80?lang=bi
2026-05-15,344,Negative 81,We are prohibited from extinguishing the fire on top of the altar.,Vayikra 22:2,https://www.sefaria.org/Sefer_HaMitzvot%2C_Negative_Commandments.81?lang=bi
2026-05-16,345,Negative 82,We are prohibited from offering any sacrifices on top of the golden altar in the sanctuary.,Vayikra 21:6,https://www.sefaria.org/Sefer_HaMitzvot%2C_Negative_Commandments.82?lang=bi
2026-05-16,346,Negative 83,A Kohen must wash his hands and feet before service,Shemos 30:19,https://www.sefaria.org/Sefer_HaMitzvot%2C_Negative_Commandments.83?lang=bi
2026-05-17,347,Negative 84,We are prohibited from anointing [anyone] besides the high priests and kings with the anointing oil that Moshe made.,Vayikra 21:23,https://www.sefaria.org/Sefer_HaMitzvot%2C_Negative_Commandments.84?lang=bi
2026-05-17,348,Negative 85,We are prohibited from making a vapor with the configuration of the [Temple] incense meaning that it be from those spices and proportionate to its measurements and have the intention to vaporize it.,Vayikra 21:17,https://www.sefaria.org/Sefer_HaMitzvot%2C_Negative_Commandments.85?lang=bi
2026-05-18,349,Negative 86,We are prohibited from removing the poles of the ark from their rings.,Vayikra 21:18,https://www.sefaria.org/Sefer_HaMitzvot%2C_Negative_Commandments.86?lang=bi
2026-05-18,350,Negative 87,"We are prohibited from removing the breastplate from the ephod (a type of apron worn by the high priest), but rather that the breastplate be attached to it.",Bamidbar 18:4,https://www.sefaria.org/Sefer_HaMitzvot%2C_Negative_Commandments.87?lang=bi
