Date,Sequential_Number,Mitzvah_Type_Number,Summary,Biblical_Source,Sefaria_Link
2025-10-20,1,Counting,Introduction to Counting the Mitzvos.,,https://www.sefaria.org/Sefer_HaMitzvot%2C_Introductions%2C_The_Rambam's_Introduction?lang=bi&with=Navigation&lang2=en
2025-10-21,2,Intro 1,Principle 1:That it is inappropriate to count rabbinic commandments in this category,,https://www.sefaria.org/Sefer_HaMitzvot%2C_Shorashim.1?lang=bi
2025-10-22,3,Intro 2,Principle 2: That it is inappropriate to count anything that we learn from the thirteen hermeneutic principles through which the Torah is expounded or from a (formal technical) inclusion.,,https://www.sefaria.org/Sefer_HaMitzvot%2C_Shorashim.2?lang=bi
2025-10-23,4,Intro 3,Principle 3: That it is inappropriate to count commandments that are not practiced for [all] generations.,,https://www.sefaria.org/Sefer_HaMitzvot%2C_Shorashim.3?lang=bi
2025-10-24,5,Intro 4,Principle 4: That it is inappropriate to count commands that include the whole Torah.,,https://www.sefaria.org/Sefer_HaMitzvot%2C_Shorashim.4?lang=bi
2025-10-25,6,Intro 5,Principle 5: That it is inappropriate to count the reason for a commandment as a commandment on its own.,,https://www.sefaria.org/Sefer_HaMitzvot%2C_Shorashim.5?lang=bi
2025-10-26,7,Intro 6,"Principle 6: That it is appropriate with a commandment that includes [both] a positive commandment and a negative commandment, to count the positive commandment in it with the positive commandments and the negative commandment in it with the negative commandments.",,https://www.sefaria.org/Sefer_HaMitzvot%2C_Shorashim.6?lang=bi
2025-10-27,8,Intro 7,Principle 7: That it is inappropriate to count the details of the commandments.,,https://www.sefaria.org/Sefer_HaMitzvot%2C_Shorashim.7?lang=bi
2025-10-28,9,Intro 8,Principle 8: That it is inappropriate to count the negation of a positive commandment with the negative commandments.,,https://www.sefaria.org/Sefer_HaMitzvot%2C_Shorashim.8?lang=bi
2025-10-29,10,Intro 9,"Principle 9: That it is inappropriate to count the [statements] of the negative commandments and the positive commandments, but rather the items prohibited by them or commanded by them.",,https://www.sefaria.org/Sefer_HaMitzvot%2C_Shorashim.9?lang=bi
2025-10-30,11,Intro 10,Principle 10: That it is inappropriate to count preliminaries that are for one of various purposes.,,https://www.sefaria.org/Sefer_HaMitzvot%2C_Shorashim.10?lang=bi
2025-10-31,12,Intro 11,"Principle 11: That it is inappropriate to count each of the parts of a commandment on its own, when their combination is one commandment.",,https://www.sefaria.org/Sefer_HaMitzvot%2C_Shorashim.11?lang=bi
2025-11-01,13,Intro 12,"Principle 12: That it is inappropriate to count parts of work, that are required by a command, on their own.",,https://www.sefaria.org/Sefer_HaMitzvot%2C_Shorashim.12?lang=bi
2025-11-02,14,Intro 13,Principle 13: That the count of commandments not be increased according to the number of days that one is obligated in that commandment.,,https://www.sefaria.org/Sefer_HaMitzvot%2C_Shorashim.13?lang=bi
2025-11-02,14,Intro 14,"Principle 14: That it is inappropriate to count the enactment of (fences) [punishments] among the positive commandments.",,https://www.sefaria.org/Sefer_HaMitzvot%2C_Shorashim.14?lang=bi
2025-11-03,15,Positive 1,To know there is a G‑d,Shemos 20:2,https://www.sefaria.org/Sefer_HaMitzvot%2C_Positive_Commandments.1?lang=bi
2025-11-04,16,Positive 2,We are commanded to believe in G-d's unity.,Shemos 20:3,https://www.sefaria.org/Sefer_HaMitzvot%2C_Positive_Commandments.2?lang=bi
2025-11-05,17,Positive 3,To know that He is one,Devarim 6:4,https://www.sefaria.org/Sefer_HaMitzvot%2C_Positive_Commandments.3?lang=bi
2025-11-06,18,Positive 4,"We are commanded to believe in His awe, may He be exalted, and to be afraid of Him.",Devarim 6:5,https://www.sefaria.org/Sefer_HaMitzvot%2C_Positive_Commandments.4?lang=bi
2025-11-07,19,Positive 5,We are commanded to serve G-d through prayer.,Devarim 10:20,https://www.sefaria.org/Sefer_HaMitzvot%2C_Positive_Commandments.5?lang=bi
2025-11-08,20,Positive 6,"We are commanded to associate with the sages, to gather with them and to constantly be involved with them in all manner of work and interaction in eating and drinking and business, so that it comes to us to imitate their actions and believe the truth of their words.",Vayikra 22:32,https://www.sefaria.org/Sefer_HaMitzvot%2C_Positive_Commandments.6?lang=bi
2025-11-09,21,Positive 7,We are commanded to swear by His name when it is necessary to ratify something or to deny it.,Vayikra 22:32,https://www.sefaria.org/Sefer_HaMitzvot%2C_Positive_Commandments.7?lang=bi
2025-11-10,22,Positive 8,"We are commanded to imitate Him, may He be exalted, according to our ability.",Devarim 12:4,https://www.sefaria.org/Sefer_HaMitzvot%2C_Positive_Commandments.8?lang=bi
2025-11-11,23,Positive 9,We are commanded to sanctify His name.,Devarim 18:15,https://www.sefaria.org/Sefer_HaMitzvot%2C_Positive_Commandments.9?lang=bi
2025-11-12,24,Positive 10,Not to test the prophet unduly,Devarim 6:16,https://www.sefaria.org/Sefer_HaMitzvot%2C_Positive_Commandments.10?lang=bi
2025-11-13,25,Positive 11,We are commanded to study Torah and to teach it.,Devarim 28:9,https://www.sefaria.org/Sefer_HaMitzvot%2C_Positive_Commandments.11?lang=bi
2025-11-14,26,Positive 12,We are commanded to put on the head tefillin.,Devarim 10:20,https://www.sefaria.org/Sefer_HaMitzvot%2C_Positive_Commandments.12?lang=bi
2025-11-15,27,Positive 13,We are commanded to put on the hand tefillin.,Vayikra 19:18,https://www.sefaria.org/Sefer_HaMitzvot%2C_Positive_Commandments.13?lang=bi
2025-11-16,28,Positive 14,We are commanded to make tzitzit (fringes).,Devarim 10:19,https://www.sefaria.org/Sefer_HaMitzvot%2C_Positive_Commandments.14?lang=bi
2025-11-17,29,Positive 15,We are commanded to make a mezuzah.,Vayikra 19:17,https://www.sefaria.org/Sefer_HaMitzvot%2C_Positive_Commandments.15?lang=bi
2025-11-18,30,Positive 16,"We are commanded to assemble the people on the second day of Sukkos at the end of the sabbatical year, and to read some sections of Devarim so they can hear it.",Vayikra 19:17,https://www.sefaria.org/Sefer_HaMitzvot%2C_Positive_Commandments.16?lang=bi
2025-11-19,31,Positive 17,"We are commanded that any king from our nation that sits on the royal throne should write a Torah scroll for himself, and that it not be separated from him.",Vayikra 19:17,https://www.sefaria.org/Sefer_HaMitzvot%2C_Positive_Commandments.17?lang=bi
2025-11-20,32,Positive 18,We are commanded that every man among us should write a Torah scroll for himself.,Shemos 22:21,https://www.sefaria.org/Sefer_HaMitzvot%2C_Positive_Commandments.18?lang=bi
2025-11-21,33,Positive 19,We are commanded to bless Him after eating.,Vayikra 19:16,https://www.sefaria.org/Sefer_HaMitzvot%2C_Positive_Commandments.19?lang=bi
2025-11-22,34,Positive 20,"We are commanded to build a choice house for Divine service, in which there will be sacrifices and an eternal burning of fire; and to which there will be journeying and pilgrimage on the festivals, and gatherings every year.",Vayikra 19:18,https://www.sefaria.org/Sefer_HaMitzvot%2C_Positive_Commandments.20?lang=bi
2025-11-23,35,Positive 21,Not to bear a grudge,Vayikra 19:18,https://www.sefaria.org/Sefer_HaMitzvot%2C_Positive_Commandments.21?lang=bi
2025-11-24,36,Positive 22,"We are commanded to guard the Temple and to constantly walk around it, to honor it, to exalt it and to aggrandize it.",Devarim 6:7,https://www.sefaria.org/Sefer_HaMitzvot%2C_Positive_Commandments.22?lang=bi
2025-11-25,37,Positive 23,We are commanded to serve G-d.,Vayikra 19:32,https://www.sefaria.org/Sefer_HaMitzvot%2C_Positive_Commandments.23?lang=bi
2025-11-26,38,Positive 24,We are commanded to serve G-d.,Vayikra 19:4,https://www.sefaria.org/Sefer_HaMitzvot%2C_Positive_Commandments.24?lang=bi
2025-11-27,39,Positive 25,We are commanded regarding priestly service.,Bamidbar 15:39,https://www.sefaria.org/Sefer_HaMitzvot%2C_Positive_Commandments.25?lang=bi
2025-11-28,40,Positive 26,We are commanded that the priests bless Israel with the Priestly Blessing.,Shemos 22:27,https://www.sefaria.org/Sefer_HaMitzvot%2C_Positive_Commandments.26?lang=bi
2025-11-29,41,Positive 27,We are commanded to place the bread of display always in front of Him.,Shemos 20:5,https://www.sefaria.org/Sefer_HaMitzvot%2C_Positive_Commandments.27?lang=bi
2025-11-30,42,Positive 28,We are commanded regarding priestly service.,Shemos 20:5,https://www.sefaria.org/Sefer_HaMitzvot%2C_Positive_Commandments.28?lang=bi
2025-12-01,43,Positive 29,We are commanded to burn a fire on the altar every day continuously.,Shemos 20:4,https://www.sefaria.org/Sefer_HaMitzvot%2C_Positive_Commandments.29?lang=bi
2025-12-02,44,Positive 30,We are commanded regarding priestly service.,Vayikra 19:4,https://www.sefaria.org/Sefer_HaMitzvot%2C_Positive_Commandments.30?lang=bi
2025-12-03,45,Positive 31,We are commanded to send away the impure from the camp.,Shemos 20:20,https://www.sefaria.org/Sefer_HaMitzvot%2C_Positive_Commandments.31?lang=bi
2025-12-04,46,Positive 32,"We are commanded to honor the seed of Aharon, to adorn and glorify them, and that we should place them on a level of priority and precedence.",Shemos 23:13,https://www.sefaria.org/Sefer_HaMitzvot%2C_Positive_Commandments.32?lang=bi
2025-12-05,47,Positive 33,We are commanded to serve G-d.,Devarim 13:17,https://www.sefaria.org/Sefer_HaMitzvot%2C_Positive_Commandments.33?lang=bi
2025-12-06,48,Positive 34,We are commanded to serve G-d.,Devarim 13:17,https://www.sefaria.org/Sefer_HaMitzvot%2C_Positive_Commandments.34?lang=bi
2025-12-07,49,Positive 35,"We are commanded that we have oil made according to the special recipe, ready to anoint the high priest when he is appointed as He said, ""The priest who is exalted above his fellows, on whose head the anointing oil has been poured"" (Vayikra 21:10).",Devarim 13:18,https://www.sefaria.org/Sefer_HaMitzvot%2C_Positive_Commandments.35?lang=bi
2025-12-08,50,Positive 36,"We are commanded that the priests serve in watches, each watch serving one week.",Devarim 13:12,https://www.sefaria.org/Sefer_HaMitzvot%2C_Positive_Commandments.36?lang=bi
2025-12-09,51,Positive 37,We are commanded to serve G-d.,Devarim 13:9,https://www.sefaria.org/Sefer_HaMitzvot%2C_Positive_Commandments.37?lang=bi
2025-12-10,52,Positive 38,We are commanded regarding priestly service.,Devarim 13:9,https://www.sefaria.org/Sefer_HaMitzvot%2C_Positive_Commandments.38?lang=bi
2025-12-11,53,Positive 39,"We are commanded to sacrifice two one-year old lambs in the Temple everyday, and these are called the daily offerings (<i>temidim</i>).",Devarim 13:9,https://www.sefaria.org/Sefer_HaMitzvot%2C_Positive_Commandments.39?lang=bi
2025-12-12,54,Positive 40,We are commanded that the high priest offer a regular grain offering every day in the morning and in the afternoon.,Devarim 13:9,https://www.sefaria.org/Sefer_HaMitzvot%2C_Positive_Commandments.40?lang=bi
2025-12-13,55,Positive 41,We are commanded to offer additional sacrifices on Shabbat (two one-year old lambs).,Devarim 13:9,https://www.sefaria.org/Sefer_HaMitzvot%2C_Positive_Commandments.41?lang=bi
2025-12-14,56,Positive 42,We are commanded to offer additional sacrifices on Rosh Chodesh (first day of month).,Devarim 18:20,https://www.sefaria.org/Sefer_HaMitzvot%2C_Positive_Commandments.42?lang=bi
2025-12-15,57,Positive 43,We are commanded to offer additional sacrifices on all seven days of Pesach.,Devarim 13:4,https://www.sefaria.org/Sefer_HaMitzvot%2C_Positive_Commandments.43?lang=bi
2025-12-16,58,Positive 44,We are commanded to offer additional sacrifices on Shavuos.,Devarim 18:20,https://www.sefaria.org/Sefer_HaMitzvot%2C_Positive_Commandments.44?lang=bi
2025-12-17,59,Positive 45,We are commanded to offer additional sacrifices on Rosh Hashana.,Devarim 18:22,https://www.sefaria.org/Sefer_HaMitzvot%2C_Positive_Commandments.45?lang=bi
2025-12-18,60,Positive 46,"We are commanded to bring two breads of chametz to the Temple with the sacrifices that come with the bread on Shavuos which is fixed for the bringing of the sacrifice, as it appears in Vayikra and that the priests eat the two breads, after their waving, with the lambs of the peace offering.",Shemos 23:13,https://www.sefaria.org/Sefer_HaMitzvot%2C_Positive_Commandments.46?lang=bi
2025-12-19,61,Positive 47,We are commanded to offer additional sacrifices on Yom Kippur.,Vayikra 19:31,https://www.sefaria.org/Sefer_HaMitzvot%2C_Positive_Commandments.47?lang=bi
2025-12-20,62,Positive 48,We are commanded to offer additional sacrifices on Sukkos.,Vayikra 19:31,https://www.sefaria.org/Sefer_HaMitzvot%2C_Positive_Commandments.48?lang=bi
2025-12-21,63,Positive 49,Not to pass your children through the fire to Molech,Vayikra 18:21,https://www.sefaria.org/Sefer_HaMitzvot%2C_Positive_Commandments.49?lang=bi
2025-12-22,64,Positive 50,We are commanded to offer additional sacrifices on Shmini Atzeret.,Devarim 16:22,https://www.sefaria.org/Sefer_HaMitzvot%2C_Positive_Commandments.50?lang=bi
2025-12-23,65,Positive 51,We are commanded to offer the daily burnt offering (Tamid) twice daily.,Vayikra 26:1,https://www.sefaria.org/Sefer_HaMitzvot%2C_Positive_Commandments.51?lang=bi
2025-12-24,66,Positive 52,We are commanded to ascend to the Temple three times a year.,Devarim 16:21,https://www.sefaria.org/Sefer_HaMitzvot%2C_Positive_Commandments.52?lang=bi
2025-12-25,67,Positive 53,We are commanded to appear [at the Temple] on festivals.,Devarim 12:2,https://www.sefaria.org/Sefer_HaMitzvot%2C_Positive_Commandments.53?lang=bi
2025-12-26,68,Positive 54,We are commanded to rejoice in the the festivals.,Devarim 7:26,https://www.sefaria.org/Sefer_HaMitzvot%2C_Positive_Commandments.54?lang=bi
2025-12-27,69,Positive 55,We are commanded to slaughter the Pesach-offering on the fourteenth of Nissan in the afternoon.,Devarim 7:25,https://www.sefaria.org/Sefer_HaMitzvot%2C_Positive_Commandments.55?lang=bi
2025-12-28,70,Positive 56,"We are commanded to eat the lamb of the Pesach-offering on the night of the fifteenth of Nissan according to the stipulations mentioned and that is that it is roasted, that it is eaten in one house and that is eaten with matzah and bitter herbs (<i>maror</i>).",Devarim 7:2,https://www.sefaria.org/Sefer_HaMitzvot%2C_Positive_Commandments.56?lang=bi
2025-12-29,71,Positive 57,"We are commanded that whoever was prevented from slaughtering the first Pesach-offering, slaughter the second Pesach-offering.",Devarim 7:2,https://www.sefaria.org/Sefer_HaMitzvot%2C_Positive_Commandments.57?lang=bi
2025-12-30,72,Positive 58,We are commanded to eat from the meat of the second-Pesach offering on the night of the fifteenth of Iyar over matzah and bitter herbs.,Shemos 23:33,https://www.sefaria.org/Sefer_HaMitzvot%2C_Positive_Commandments.58?lang=bi
2025-12-31,73,Positive 59,We are commanded to blow with trumpets in the Temple during the bringing of the holiday offerings.,Vayikra 20:23,https://www.sefaria.org/Sefer_HaMitzvot%2C_Positive_Commandments.59?lang=bi
2025-12-31,74,Positive 60,We are commanded that any animal sacrifice that we offer be eight days old or more and not less.,Vayikra 19:26,https://www.sefaria.org/Sefer_HaMitzvot%2C_Positive_Commandments.60?lang=bi
2026-01-01,75,Positive 61,We are commanded that all of that which we offer Him be consummate for its type flawless from blemishes that appear in Scripture and those that they pronounced as such from tradition.,Devarim 18:10,https://www.sefaria.org/Sefer_HaMitzvot%2C_Positive_Commandments.61?lang=bi
2026-01-01,76,Positive 62,We are commanded to offer salt on every sacrifice.,Vayikra 19:26,https://www.sefaria.org/Sefer_HaMitzvot%2C_Positive_Commandments.62?lang=bi
2026-01-02,77,Positive 63,We are commanded with the process of the burnt-offering sacrifice.,Devarim 18:11,https://www.sefaria.org/Sefer_HaMitzvot%2C_Positive_Commandments.63?lang=bi
2026-01-02,78,Positive 64,"We are commanded with the process of the sin-offering sacrifice, according to the description that is mentioned whatever sin-offering it may be.",Devarim 18:11,https://www.sefaria.org/Sefer_HaMitzvot%2C_Positive_Commandments.64?lang=bi
2026-01-03,79,Positive 65,"We are commanded with the process of the guilt-offering sacrifice according to the description that is mentioned with His saying, ""And this is the law of the guilt-offering"" (Vayikra 7:1).",Devarim 18:11,https://www.sefaria.org/Sefer_HaMitzvot%2C_Positive_Commandments.65?lang=bi
2026-01-03,80,Positive 66,"We are commanded with the process of the peace-offering sacrifices according to the description that is mentioned with His saying, ""And if his sacrifice is a sacrifice of peace-offerings"" (Vayikra 3:1).",Devarim 18:11,https://www.sefaria.org/Sefer_HaMitzvot%2C_Positive_Commandments.66?lang=bi
2026-01-04,81,Positive 67,"We are commanded with the process of the meal-offering sacrifices, according to the description that is mentioned for each and every type.",Devarim 18:10,https://www.sefaria.org/Sefer_HaMitzvot%2C_Positive_Commandments.67?lang=bi
2026-01-04,82,Positive 68,We are commanded that the court should offer a sacrifice if they erred in a directive.,Vayikra 19:27,https://www.sefaria.org/Sefer_HaMitzvot%2C_Positive_Commandments.68?lang=bi
2026-01-05,83,Positive 69,We are commanded that anyone who erred in a sin and is an individual offer a sin-offering sacrifice.,Vayikra 19:27,https://www.sefaria.org/Sefer_HaMitzvot%2C_Positive_Commandments.69?lang=bi
2026-01-05,84,Positive 70,"We are commanded to offer a sacrifice when a doubt arises about one of the big sins for which we are liable excision when volitional, and a fixed sin-offering when inadvertent.",Devarim 22:5,https://www.sefaria.org/Sefer_HaMitzvot%2C_Positive_Commandments.70?lang=bi
2026-01-06,85,Positive 71,We are commanded that one who does certain sins must offer a guilt-offering sacrifice.,Devarim 22:5,https://www.sefaria.org/Sefer_HaMitzvot%2C_Positive_Commandments.71?lang=bi
2026-01-06,86,Positive 72,We are commanded regarding the Temple.,Vayikra 19:28,https://www.sefaria.org/Sefer_HaMitzvot%2C_Positive_Commandments.72?lang=bi
2026-01-07,87,Positive 73,We are commanded to confess the transgressions and sins that we have done before G-d and to say them together with [our] repentance.,Devarim 14:1,https://www.sefaria.org/Sefer_HaMitzvot%2C_Positive_Commandments.73?lang=bi
2026-01-07,88,Positive 74,We are commanded that any man who is healed from a discharge offer a sacrifice.,Devarim 14:1,https://www.sefaria.org/Sefer_HaMitzvot%2C_Positive_Commandments.74?lang=bi
2026-01-08,89,Positive 75,We are commanded that any woman who is healed from a discharge offer a sacrifice and that is two turtledoves or two young pigeons.,Bamidbar 5:7,https://www.sefaria.org/Sefer_HaMitzvot%2C_Positive_Commandments.75?lang=bi
2026-01-08,90,Positive 76,"We are commanded that any woman after childbirth offer a sacrifice and that is a one-year old lamb as a burnt-offering, and a young pigeon or a turtledove as a sin-offering.",Devarim 6:7,https://www.sefaria.org/Sefer_HaMitzvot%2C_Positive_Commandments.76?lang=bi
2026-01-09,91,Positive 77,We are commanded that someone with <i>tzaraas</i> offer a sacrifice when he is healed from it.,Shemos 23:25,https://www.sefaria.org/Sefer_HaMitzvot%2C_Positive_Commandments.77?lang=bi
2026-01-09,92,Positive 78,"We are commanded to extract a tenth of the animals that are born to us each year, to offer their fat and blood and to eat the rest in Jerusalem.",Bamidbar 6:23,https://www.sefaria.org/Sefer_HaMitzvot%2C_Positive_Commandments.78?lang=bi
2026-01-10,93,Positive 79,"We are commanded to consecrate firstborn animals meaning, to separate and designate them for what is appropriate for one to do with them.",Devarim 6:8,https://www.sefaria.org/Sefer_HaMitzvot%2C_Positive_Commandments.79?lang=bi
2026-01-10,94,Positive 80,"We are commanded to redeem the firstborn man, that we should give the money to the priest.",Devarim 6:8,https://www.sefaria.org/Sefer_HaMitzvot%2C_Positive_Commandments.80?lang=bi
2026-01-11,95,Positive 81,"We are commanded that we should redeem the [firstborn] donkey specifically with a sheep, and it should not be redeemed with anything else.",Devarim 6:9,https://www.sefaria.org/Sefer_HaMitzvot%2C_Positive_Commandments.81?lang=bi
2026-01-11,96,Positive 82,We are commanded to behead the [firstborn] donkey if we do not redeem it.,Devarim 31:19,https://www.sefaria.org/Sefer_HaMitzvot%2C_Positive_Commandments.82?lang=bi
2026-01-12,97,Positive 83,The king must have a separate Sefer Torah for himself,Devarim 17:18,https://www.sefaria.org/Sefer_HaMitzvot%2C_Positive_Commandments.83?lang=bi
2026-01-12,98,Positive 84,We are commanded to offer all of the sacrifices in the [Temple].,Bamidbar 15:38,https://www.sefaria.org/Sefer_HaMitzvot%2C_Positive_Commandments.84?lang=bi
2026-01-13,99,Positive 85,"We are commanded to bring any sin-offering, burnt-offering, guilt-offering and peace-offerings, which we are obligated, to the [Temple].",Devarim 8:10,https://www.sefaria.org/Sefer_HaMitzvot%2C_Positive_Commandments.85?lang=bi
2026-01-13,100,Positive 86,"We are commanded to redeem consecrated animals which have developed blemishes, such that it becomes mundane and permissible to slaughter and eat it.",Vayikra 12:3,https://www.sefaria.org/Sefer_HaMitzvot%2C_Positive_Commandments.86?lang=bi
2026-01-14,101,Positive 87,We are commanded that the substitute [of a consecrated item] be consecrated.,Shemos 23:12,https://www.sefaria.org/Sefer_HaMitzvot%2C_Positive_Commandments.87?lang=bi
2026-01-14,102,Positive 88,We are commanded regarding the service of Levites in the Temple.,Shemos 20:10,https://www.sefaria.org/Sefer_HaMitzvot%2C_Positive_Commandments.88?lang=bi
2026-01-15,103,Positive 89,We are commanded regarding the Temple.,Shemos 35:3,https://www.sefaria.org/Sefer_HaMitzvot%2C_Positive_Commandments.89?lang=bi
2026-01-15,104,Positive 90,We are commanded that priests wash their hands and feet before Temple service.,Shemos 16:29,https://www.sefaria.org/Sefer_HaMitzvot%2C_Positive_Commandments.90?lang=bi
2026-01-16,105,Positive 91,We are commanded to light the menorah daily in the Temple.,Shemos 20:8,https://www.sefaria.org/Sefer_HaMitzvot%2C_Positive_Commandments.91?lang=bi
2026-01-16,106,Positive 92,We are commanded that a nazarite should grow his hair.,Vayikra 23:32,https://www.sefaria.org/Sefer_HaMitzvot%2C_Positive_Commandments.92?lang=bi
2026-01-17,107,Positive 93,We are commanded to shave the nazarite's head and to bring his sacrifices at the culmination of his nazariteship.,Vayikra 23:31,https://www.sefaria.org/Sefer_HaMitzvot%2C_Positive_Commandments.93?lang=bi
2026-01-17,108,Positive 94,"We are commanded to fulfill everything that we we take upon ourselves in speech, whether in an oath, a vow, charity, a sacrifice or anything else besides them.",Vayikra 16:29,https://www.sefaria.org/Sefer_HaMitzvot%2C_Positive_Commandments.94?lang=bi
2026-01-18,109,Positive 95,We are commanded to administer the nullification of vows meaning the precept that He instructed us about these laws.,Vayikra 23:29,https://www.sefaria.org/Sefer_HaMitzvot%2C_Positive_Commandments.95?lang=bi
2026-01-18,110,Positive 96,"We are commanded that when any person touches a carcass, he becomes impure.",Vayikra 23:8,https://www.sefaria.org/Sefer_HaMitzvot%2C_Positive_Commandments.96?lang=bi
2026-01-19,111,Positive 97,We are commanded to [administer the laws of impurity] of eight creeping creatures.,Vayikra 23:8,https://www.sefaria.org/Sefer_HaMitzvot%2C_Positive_Commandments.97?lang=bi
2026-01-19,112,Positive 98,We are commanded to administer [the laws of] impurity of foods and drinks.,Vayikra 23:8,https://www.sefaria.org/Sefer_HaMitzvot%2C_Positive_Commandments.98?lang=bi
2026-01-20,113,Positive 99,We are commanded that a menstruant woman be impure.,Vayikra 23:8,https://www.sefaria.org/Sefer_HaMitzvot%2C_Positive_Commandments.99?lang=bi
2026-01-20,114,Positive 100,We are commanded that a woman after childbirth be impure.,Vayikra 23:21,https://www.sefaria.org/Sefer_HaMitzvot%2C_Positive_Commandments.100?lang=bi
2026-01-21,115,Positive 101,We are commanded that a <i>metzora</i> be impure.,Vayikra 23:21,https://www.sefaria.org/Sefer_HaMitzvot%2C_Positive_Commandments.101?lang=bi
2026-01-21,116,Positive 102,"We are commanded to administer the laws of the impurity of a garment that has <i>tzaraas</i>, such that it be impure.",Vayikra 23:24,https://www.sefaria.org/Sefer_HaMitzvot%2C_Positive_Commandments.102?lang=bi
2026-01-22,117,Positive 103,We are commanded that a house that has <i>tzaraas</i> be impure.,Vayikra 23:25,https://www.sefaria.org/Sefer_HaMitzvot%2C_Positive_Commandments.103?lang=bi
2026-01-22,118,Positive 104,We are commanded that a <i>zav</i> be impure.,Vayikra 23:35,https://www.sefaria.org/Sefer_HaMitzvot%2C_Positive_Commandments.104?lang=bi
2026-01-23,119,Positive 105,We are commanded that semen be impure.,Vayikra 23:35,https://www.sefaria.org/Sefer_HaMitzvot%2C_Positive_Commandments.105?lang=bi
2026-01-23,120,Positive 106,We are commanded that a <i>zavah</i> be impure.,Vayikra 23:36,https://www.sefaria.org/Sefer_HaMitzvot%2C_Positive_Commandments.106?lang=bi
2026-01-24,121,Positive 107,We are commanded to administer [the laws of] the impurity of a corpse.,Vayikra 23:36,https://www.sefaria.org/Sefer_HaMitzvot%2C_Positive_Commandments.107?lang=bi
2026-01-24,122,Positive 108,"We are commanded and instructed us [to administer] the laws of purification water, about which they said that it renders impure in one way and purifies in another way as is explained in the analysis of this commandment.",Devarim 16:3,https://www.sefaria.org/Sefer_HaMitzvot%2C_Positive_Commandments.108?lang=bi
