Date,Sequential_Number,Mitzvah_Type_Number,Summary,Biblical_Source,Sefaria_Link
2026-07-18,471,Negative 208,We are prohibited from the nazirite from entering into the tent of a corpse.,Vayikra 15:25,https://www.sefaria.org/Sefer_HaMitzvot%2C_Negative_Commandments.208?lang=bi
2026-07-18,472,Negative 209,We are prohibited from the nazirite from shaving.,Vayikra 15:3,https://www.sefaria.org/Sefer_HaMitzvot%2C_Negative_Commandments.209?lang=bi
2026-07-19,473,Negative 210,We are prohibited from not to harvest all of what is planted.,Vayikra 11:39,https://www.sefaria.org/Sefer_HaMitzvot%2C_Negative_Commandments.210?lang=bi
2026-07-19,474,Negative 211,We are prohibited from not to glean the sheaves that fall in the field at the time of the harvest.,Vayikra 11:29,https://www.sefaria.org/Sefer_HaMitzvot%2C_Negative_Commandments.211?lang=bi
2026-07-20,475,Negative 212,We are prohibited from harvesting the <i>ollalot</i> (incomplete clusters) of the vineyard at the time of the harvest.,Vayikra 15:16,https://www.sefaria.org/Sefer_HaMitzvot%2C_Negative_Commandments.212?lang=bi
2026-07-20,476,Negative 213,We are prohibited from not to gather the single grapes that fall in the vineyard at the time of the harvest.,Vayikra 11:34,https://www.sefaria.org/Sefer_HaMitzvot%2C_Negative_Commandments.213?lang=bi
2026-07-21,477,Negative 214,We are prohibited from taking the forgotten sheaves.,Vayikra 15:16,https://www.sefaria.org/Sefer_HaMitzvot%2C_Negative_Commandments.214?lang=bi
2026-07-21,478,Negative 215,We are prohibited from planting forbidden mixtures.,Shemos 21:28,https://www.sefaria.org/Sefer_HaMitzvot%2C_Negative_Commandments.215?lang=bi
2026-07-22,479,Negative 216,We are prohibited from planting grain as well as other vegetables in a vineyard.,Shemos 22:4,https://www.sefaria.org/Sefer_HaMitzvot%2C_Negative_Commandments.216?lang=bi
2026-07-22,480,Negative 217,We are prohibited from breeding forbidden mixtures of animals.,Shemos 21:33,https://www.sefaria.org/Sefer_HaMitzvot%2C_Negative_Commandments.217?lang=bi
2026-07-23,481,Negative 218,We are prohibited from doing work with a forbidden mixture of animals together.,Shemos 22:5,https://www.sefaria.org/Sefer_HaMitzvot%2C_Negative_Commandments.218?lang=bi
2026-07-23,482,Negative 219,"We are prohibited from preventing an animal from eating from the thing upon which it is doing its work such that if it is threshing a threshing field or carrying straw on its back from one place to another, he may not prevent it from eating from it.",Vayikra 19:11,https://www.sefaria.org/Sefer_HaMitzvot%2C_Negative_Commandments.219?lang=bi
2026-07-24,483,Negative 220,We are prohibited from working the land in the seventh year.,Shemos 21:37,https://www.sefaria.org/Sefer_HaMitzvot%2C_Negative_Commandments.220?lang=bi
2026-07-24,484,Negative 221,We are prohibited from doing work on trees in the seventh year.,Vayikra 19:36,https://www.sefaria.org/Sefer_HaMitzvot%2C_Negative_Commandments.221?lang=bi
2026-07-25,485,Negative 222,"We are prohibited from but according to the torah, we are allowed to eat what was planted on the sixth year - and that is called the aftergrowth - in the seventh year.",Vayikra 19:35,https://www.sefaria.org/Sefer_HaMitzvot%2C_Negative_Commandments.222?lang=bi
2026-07-25,486,Negative 223,We are prohibited from picking the fruit which grew on the trees in the seventh year in the [same] way that we gather their fruits every year.,Devarim 25:13,https://www.sefaria.org/Sefer_HaMitzvot%2C_Negative_Commandments.223?lang=bi
2026-07-26,487,Negative 224,We are prohibited from working the land in the jubilee year.,Devarim 19:14,https://www.sefaria.org/Sefer_HaMitzvot%2C_Negative_Commandments.224?lang=bi
2026-07-26,488,Negative 225,We are prohibited from harvesting the aftergrowth in the Jubilee year.,Shemos 20:13,https://www.sefaria.org/Sefer_HaMitzvot%2C_Negative_Commandments.225?lang=bi
2026-07-27,489,Negative 226,We are prohibited from harvesting fruit of the trees in the jubilee year in the way that we collect [them] in other years.,Vayikra 19:13,https://www.sefaria.org/Sefer_HaMitzvot%2C_Negative_Commandments.226?lang=bi
2026-07-27,490,Negative 227,We are prohibited from not to sell our land in the land of israel [as a] permanent sale.,Vayikra 19:13,https://www.sefaria.org/Sefer_HaMitzvot%2C_Negative_Commandments.227?lang=bi
2026-07-28,491,Negative 228,We are prohibited from changing the open places of the Levites.,Shemos 20:14,https://www.sefaria.org/Sefer_HaMitzvot%2C_Negative_Commandments.228?lang=bi
2026-07-28,492,Negative 229,"We are prohibited from abandoning and ignoring the Levites, regarding the giving of their due and gladdening them on the festival.",Devarim 5:18,https://www.sefaria.org/Sefer_HaMitzvot%2C_Negative_Commandments.229?lang=bi
2026-07-29,493,Negative 230,"We are prohibited from not to claim debts on the sabbatical year, but rather to release them all.",Vayikra 5:23,https://www.sefaria.org/Sefer_HaMitzvot%2C_Negative_Commandments.230?lang=bi
2026-07-29,494,Negative 231,"We are prohibited from the refraining from lending to some of us because of the sabbatical year, so that [such a] debt not be released.",Devarim 22:3,https://www.sefaria.org/Sefer_HaMitzvot%2C_Negative_Commandments.231?lang=bi
2026-07-30,495,Negative 232,"We are prohibited from refraining to give charity and comfort to our poor brothers, about whose poverty we are aware and whom we have the ability to support.",Devarim 22:1,https://www.sefaria.org/Sefer_HaMitzvot%2C_Negative_Commandments.232?lang=bi
2026-07-30,496,Negative 233,We are prohibited from the sending away of a hebrew (jewish) slave empty-handed when he goes out to freedom at the end of six years.,Shemos 21:18,https://www.sefaria.org/Sefer_HaMitzvot%2C_Negative_Commandments.233?lang=bi
2026-07-31,497,Negative 234,Not to murder,Shemos 20:13,https://www.sefaria.org/Sefer_HaMitzvot%2C_Negative_Commandments.234?lang=bi
2026-07-31,498,Negative 235,"We are prohibited from and that is his, may he be exalted, saying, ""your money you shall not give him on interest, and on increase you shall not give your food"" (Vayikra 25:37).",Bamidbar 35:31,https://www.sefaria.org/Sefer_HaMitzvot%2C_Negative_Commandments.235?lang=bi
2026-08-01,499,Negative 236,We are prohibited from the borrower - that he should not borrow with interest.,Bamidbar 35:25,https://www.sefaria.org/Sefer_HaMitzvot%2C_Negative_Commandments.236?lang=bi
2026-08-01,500,Negative 237,"We are prohibited from being involved with a loan with interest between a borrow and a lender - not to be a guarantor for one of them, not to be a witness for them and not to write a contract about what they agreed upon about the interest.",Bamidbar 35:32,https://www.sefaria.org/Sefer_HaMitzvot%2C_Negative_Commandments.237?lang=bi
2026-08-02,501,Negative 238,We are prohibited from not to oppress the employee and not to delay his wage with us.,Bamidbar 35:12,https://www.sefaria.org/Sefer_HaMitzvot%2C_Negative_Commandments.238?lang=bi
2026-08-02,502,Negative 239,Save someone being pursued even by taking the life of the pursuer,Devarim 25:12,https://www.sefaria.org/Sefer_HaMitzvot%2C_Negative_Commandments.239?lang=bi
2026-08-03,503,Negative 240,We are prohibited from keeping the collateral item from its owners during the time that he needs it.,Bamidbar 35:12,https://www.sefaria.org/Sefer_HaMitzvot%2C_Negative_Commandments.240?lang=bi
2026-08-03,504,Negative 241,"We are prohibited from taking collateral from a widow - whether poor or rich - as it is stated (Devarim 24:17), ""you shall not take a widow’s garment in pawn.",Vayikra 19:16,https://www.sefaria.org/Sefer_HaMitzvot%2C_Negative_Commandments.241?lang=bi
2026-08-04,505,Negative 242,"We are prohibited from taking in pawn, vessels with which people prepare their food, such as tools for grinding, kneading and cooking and tools for the slaughter of animals and other ones besides this that are grouped by the name, 'something with which food of sustenance (<i>okhel nefesh</i>) is made' as it is stated, ""for it is a soul that he takes in pledge"" (Devarim 24:6).",Devarim 19:3,https://www.sefaria.org/Sefer_HaMitzvot%2C_Negative_Commandments.242?lang=bi
2026-08-04,506,Negative 243,We are prohibited from - to not steal (kidnap) an israelite person.,Devarim 21:4,https://www.sefaria.org/Sefer_HaMitzvot%2C_Negative_Commandments.243?lang=bi
2026-08-05,507,Negative 244,We are prohibited from we not steal money.,Devarim 21:4,https://www.sefaria.org/Sefer_HaMitzvot%2C_Negative_Commandments.244?lang=bi
2026-08-05,508,Negative 245,"We are prohibited from we not steal that to we which we do not have entitlement, by force and duress.",Devarim 22:8,https://www.sefaria.org/Sefer_HaMitzvot%2C_Negative_Commandments.245?lang=bi
2026-08-06,509,Negative 246,We are prohibited from we not steal the boundary of the land.,Devarim 22:8,https://www.sefaria.org/Sefer_HaMitzvot%2C_Negative_Commandments.246?lang=bi
2026-08-06,510,Negative 247,Not to put a stumbling block before a blind man (nor give harmful advice),Vayikra 19:14,https://www.sefaria.org/Sefer_HaMitzvot%2C_Negative_Commandments.247?lang=bi
2026-08-07,511,Negative 248,We are prohibited from we not deny obligations that we are indebted and deposits held by us.,Shemos 23:5,https://www.sefaria.org/Sefer_HaMitzvot%2C_Negative_Commandments.248?lang=bi
2026-08-07,512,Negative 249,We are prohibited from swearing [falsely] about the denial of money that is incumbent upon us [to pay].,Devarim 22:4,https://www.sefaria.org/Sefer_HaMitzvot%2C_Negative_Commandments.249?lang=bi
2026-08-08,513,Negative 250,We are prohibited from some of us from wronging others of us in trade and in buying and selling.,Devarim 22:4,https://www.sefaria.org/Sefer_HaMitzvot%2C_Negative_Commandments.250?lang=bi
2026-08-08,514,Negative 251,Buy and sell according to Torah law,Vayikra 25:14,https://www.sefaria.org/Sefer_HaMitzvot%2C_Negative_Commandments.251?lang=bi
2026-08-09,515,Negative 252,We are prohibited from wronging the convert with words.,Vayikra 25:14,https://www.sefaria.org/Sefer_HaMitzvot%2C_Negative_Commandments.252?lang=bi
2026-08-09,516,Negative 253,We are prohibited from wronging the convert and causing him damage in buying and selling.,Vayikra 25:17,https://www.sefaria.org/Sefer_HaMitzvot%2C_Negative_Commandments.253?lang=bi
2026-08-10,517,Negative 254,"We are prohibited from returning, a slave who ran away from outside of the Land to the Land of Israel, to his master.",Shemos 22:20,https://www.sefaria.org/Sefer_HaMitzvot%2C_Negative_Commandments.254?lang=bi
2026-08-10,518,Negative 255,We are prohibited from wronging a slave that runs away to us.,Shemos 22:20,https://www.sefaria.org/Sefer_HaMitzvot%2C_Negative_Commandments.255?lang=bi
2026-08-11,519,Negative 256,Purchase a Hebrew slave in accordance with the prescribed laws,Shemos 21:2,https://www.sefaria.org/Sefer_HaMitzvot%2C_Negative_Commandments.256?lang=bi
2026-08-11,520,Negative 257,Not to sell him as a slave is sold,Vayikra 25:42,https://www.sefaria.org/Sefer_HaMitzvot%2C_Negative_Commandments.257?lang=bi
2026-08-12,521,Negative 258,Not to work him oppressively,Vayikra 25:43,https://www.sefaria.org/Sefer_HaMitzvot%2C_Negative_Commandments.258?lang=bi
2026-08-12,522,Negative 259,Not to allow a non-Jew to work him oppressively,Vayikra 25:53,https://www.sefaria.org/Sefer_HaMitzvot%2C_Negative_Commandments.259?lang=bi
2026-08-13,523,Negative 260,Not to have him do menial slave labor,Vayikra 25:39,https://www.sefaria.org/Sefer_HaMitzvot%2C_Negative_Commandments.260?lang=bi
2026-08-13,524,Negative 261,We are prohibited from we not sell a Hebrew (Jewish) maidservant to someone besides ourselves.,Devarim 15:14,https://www.sefaria.org/Sefer_HaMitzvot%2C_Negative_Commandments.261?lang=bi
2026-08-14,525,Negative 262,We are prohibited from afflicting a hebrew (jewish) maidservant if one acquires her and marries her.,Devarim 15:13,https://www.sefaria.org/Sefer_HaMitzvot%2C_Negative_Commandments.262?lang=bi
2026-08-14,526,Negative 263,"We are prohibited from we not sell a [captive] woman of beautiful form (<i>yefat toar</i>), after one had sexual intercourse with her once, after the capture of the city.",Shemos 21:8,https://www.sefaria.org/Sefer_HaMitzvot%2C_Negative_Commandments.263?lang=bi
2026-08-15,527,Negative 264,We are prohibited from exploiting a captive woman (<i>yefat toar</i>) after one has sexual intercourse with her.,Shemos 21:8,https://www.sefaria.org/Sefer_HaMitzvot%2C_Negative_Commandments.264?lang=bi
2026-08-15,528,Negative 265,The master must not sell his maidservant,Shemos 21:8,https://www.sefaria.org/Sefer_HaMitzvot%2C_Negative_Commandments.265?lang=bi
2026-08-16,529,Negative 266,"We are prohibited from putting our thoughts to coveting that which is our brothers' (fellow Jews), and to desire it.",Vayikra 25:46,https://www.sefaria.org/Sefer_HaMitzvot%2C_Negative_Commandments.266?lang=bi
2026-08-16,530,Negative 267,Not to extradite a slave who fled to (Biblical) Israel,Devarim 23:16,https://www.sefaria.org/Sefer_HaMitzvot%2C_Negative_Commandments.267?lang=bi
2026-08-17,531,Negative 268,Not to wrong a slave who has come to Israel for refuge,Devarim 23:17,https://www.sefaria.org/Sefer_HaMitzvot%2C_Negative_Commandments.268?lang=bi
2026-08-17,532,Negative 269,We are prohibited from ignoring a lost object.,Shemos 22:9,https://www.sefaria.org/Sefer_HaMitzvot%2C_Negative_Commandments.269?lang=bi
2026-08-18,533,Negative 270,We are prohibited from forsaking someone forlorn with a load stuck on the road.,Devarim 24:15,https://www.sefaria.org/Sefer_HaMitzvot%2C_Negative_Commandments.270?lang=bi
2026-08-18,534,Negative 271,Not to delay payment of wages past the agreed time,Vayikra 19:13,https://www.sefaria.org/Sefer_HaMitzvot%2C_Negative_Commandments.271?lang=bi
2026-08-19,535,Negative 272,The hired worker may eat from the unharvested crops where he works,Devarim 23:25,https://www.sefaria.org/Sefer_HaMitzvot%2C_Negative_Commandments.272?lang=bi
2026-08-19,536,Negative 273,We are prohibited from doing inequity in judgement.,Devarim 23:26,https://www.sefaria.org/Sefer_HaMitzvot%2C_Negative_Commandments.273?lang=bi
2026-08-20,537,Negative 274,We are prohibited from and the prohibition about this content has already been repeated.,Devarim 23:25,https://www.sefaria.org/Sefer_HaMitzvot%2C_Negative_Commandments.274?lang=bi
2026-08-20,538,Negative 275,"We are prohibited from and even if [the disputant] is great, honored and of stature, he should not show him favor in the case when he comes in front of him with his [fellow] disputant; and he should not inquire about his affairs and doings.",Devarim 25:4,https://www.sefaria.org/Sefer_HaMitzvot%2C_Negative_Commandments.275?lang=bi
2026-08-21,539,Negative 276,"We are prohibited from the judge from being afraid of a man who is destructive, injurious and speaks haughtily; such that [the judge] should not incline the verdict towards him.",Shemos 22:13,https://www.sefaria.org/Sefer_HaMitzvot%2C_Negative_Commandments.276?lang=bi
2026-08-21,540,Negative 277,The courts must carry out the laws of an unpaid guard,Shemos 22:6,https://www.sefaria.org/Sefer_HaMitzvot%2C_Negative_Commandments.277?lang=bi
2026-08-22,541,Negative 278,Lend to the poor and destitute,Shemos 22:24,https://www.sefaria.org/Sefer_HaMitzvot%2C_Negative_Commandments.278?lang=bi
2026-08-22,542,Negative 279,"We are prohibited from the judge - that he not have mercy upon someone who killed his fellow, or destroyed one of his limbs.",Shemos 22:24,https://www.sefaria.org/Sefer_HaMitzvot%2C_Negative_Commandments.279?lang=bi
2026-08-23,543,Negative 280,We are prohibited from the judge from slanting the judgement of converts and orphans.,Devarim 15:3,https://www.sefaria.org/Sefer_HaMitzvot%2C_Negative_Commandments.280?lang=bi
2026-08-23,544,Negative 281,We are prohibited from the judge - not to listen to one of the disputants when it is not in front of his [adversary].,Devarim 24:10,https://www.sefaria.org/Sefer_HaMitzvot%2C_Negative_Commandments.281?lang=bi
2026-08-24,545,Negative 282,"We are prohibited from and the explanation of this is that when there is a disagreement between the judges about a sinner; and some say he is liable for the death penalty and others of them say he is exempt, and the ones who incriminate him count one more man than the ones acquitting - it is surely not permissible to kill that sinner.",Devarim 24:13,https://www.sefaria.org/Sefer_HaMitzvot%2C_Negative_Commandments.282?lang=bi
2026-08-24,546,Negative 283,"We are prohibited from this means, do not seek to incline in a dispute - and that is that you incline with the majority or with the great [scholars], and that you remain silent about what your opinion is in this case.",Devarim 24:12,https://www.sefaria.org/Sefer_HaMitzvot%2C_Negative_Commandments.283?lang=bi
2026-08-25,547,Negative 284,"We are prohibited from he prohibited the great court and the head of the yeshiva - not to appoint as a judge, a man who is not learned in the discipline of torah, on account of other virtues that he has, to appoint him because of them.",Devarim 24:17,https://www.sefaria.org/Sefer_HaMitzvot%2C_Negative_Commandments.284?lang=bi
2026-08-25,548,Negative 285,"We are prohibited from and this has been repeated with a different language; and that is his saying, ""vain testimony"" (Devarim 5:17).",Devarim 24:6,https://www.sefaria.org/Sefer_HaMitzvot%2C_Negative_Commandments.285?lang=bi
2026-08-26,549,Negative 286,We are prohibited from the judge - that he not accept testimony of a sinner and not do anything based on his testimony.,Vayikra 25:37,https://www.sefaria.org/Sefer_HaMitzvot%2C_Negative_Commandments.286?lang=bi
2026-08-26,550,Negative 287,Not to borrow with interest,Devarim 23:20,https://www.sefaria.org/Sefer_HaMitzvot%2C_Negative_Commandments.287?lang=bi
2026-08-27,551,Negative 288,"We are prohibited from the judge to declare punishments, or to make one liable for money, with the testimony of one witness - even if he was most fit.",Shemos 22:24,https://www.sefaria.org/Sefer_HaMitzvot%2C_Negative_Commandments.288?lang=bi
2026-08-27,552,Negative 289,We are prohibited from the judge - not to kill someone clean and innocent.,Devarim 23:21,https://www.sefaria.org/Sefer_HaMitzvot%2C_Negative_Commandments.289?lang=bi
2026-08-28,553,Negative 290,"The courts must carry out the laws of the plaintiff, admitter, or denier",Shemos 22:8,https://www.sefaria.org/Sefer_HaMitzvot%2C_Negative_Commandments.290?lang=bi
2026-08-28,554,Negative 291,We are prohibited from the witness from speaking about the case about which he testified.,Bamidbar 27:8,https://www.sefaria.org/Sefer_HaMitzvot%2C_Negative_Commandments.291?lang=bi
2026-08-29,555,Negative 292,We are prohibited from killing those liable for the death penalty when we see that they have already done a sin for which one is liable for death before their coming to the court.,Devarim 16:18,https://www.sefaria.org/Sefer_HaMitzvot%2C_Negative_Commandments.292?lang=bi
2026-08-29,556,Negative 293,We are prohibited from we not have compassion upon a pursuer.,Devarim 1:17,https://www.sefaria.org/Sefer_HaMitzvot%2C_Negative_Commandments.293?lang=bi
2026-08-30,557,Negative 294,"We are prohibited from punishing someone forced, for the sin that he did - since he was forced into the act.",Shemos 23:2,https://www.sefaria.org/Sefer_HaMitzvot%2C_Negative_Commandments.294?lang=bi
2026-08-30,558,Negative 295,"We are prohibited from the taking of ransom from an unintentional killer, so as to exempt him from exile.",Shemos 23:2,https://www.sefaria.org/Sefer_HaMitzvot%2C_Negative_Commandments.295?lang=bi
2026-08-31,559,Negative 296,"We are prohibited from and that is his saying, ""and you shall not take ransom for the soul of a murderer who is liable for death"" (Bamidbar 35:31).",Shemos 23:2,https://www.sefaria.org/Sefer_HaMitzvot%2C_Negative_Commandments.296?lang=bi
2026-08-31,560,Negative 297,"We are prohibited from being negligent about saving the life of someone when we see him in mortal danger, or [in a case of] loss, and we have the ability to save him such as if he was drowning in the river and we know how to swim and are able to save him; or if a robber is trying to kill him and we are able to foil his plan or repel his injury.",Devarim 22:24,https://www.sefaria.org/Sefer_HaMitzvot%2C_Negative_Commandments.297?lang=bi
2026-09-01,561,Negative 298,"We are prohibited from leaving obstacles and stumbling blocks in our land and in our homes, so that people not die from them.",Vayikra 20:14,https://www.sefaria.org/Sefer_HaMitzvot%2C_Negative_Commandments.298?lang=bi
2026-09-01,562,Negative 299,We are prohibited from some of us from making others stumble.,Shemos 21:20,https://www.sefaria.org/Sefer_HaMitzvot%2C_Negative_Commandments.299?lang=bi
2026-09-02,563,Negative 300,"We are prohibited from hinting as if one will strike, even if he does not strike.",Vayikra 20:10,https://www.sefaria.org/Sefer_HaMitzvot%2C_Negative_Commandments.300?lang=bi
2026-09-02,564,Negative 301,We are prohibited from being a talebearer.,Devarim 21:22,https://www.sefaria.org/Sefer_HaMitzvot%2C_Negative_Commandments.301?lang=bi
2026-09-03,565,Negative 302,We are prohibited from that some of us hate others of us.,Devarim 21:23,https://www.sefaria.org/Sefer_HaMitzvot%2C_Negative_Commandments.302?lang=bi
2026-09-03,566,Negative 303,"We are prohibited from some of us not embarrass others of us; and that is what is called, whitening the face of one's fellow.",Devarim 21:23,https://www.sefaria.org/Sefer_HaMitzvot%2C_Negative_Commandments.303?lang=bi
2026-09-04,567,Negative 304,We are prohibited from some of us not take revenge upon some of us.,Shemos 22:17,https://www.sefaria.org/Sefer_HaMitzvot%2C_Negative_Commandments.304?lang=bi
2026-09-04,568,Negative 305,"We are prohibited from we not bear a grudge, even if we do not pay him back.",Devarim 25:2,https://www.sefaria.org/Sefer_HaMitzvot%2C_Negative_Commandments.305?lang=bi
2026-09-05,569,Negative 306,We are prohibited from we not take the nest at the time of the snare the mother and the young.,Devarim 25:3,https://www.sefaria.org/Sefer_HaMitzvot%2C_Negative_Commandments.306?lang=bi
2026-09-05,570,Negative 307,We are prohibited from shaving off the scab [of tsaraat].,Shemos 23:7,https://www.sefaria.org/Sefer_HaMitzvot%2C_Negative_Commandments.307?lang=bi
2026-09-06,571,Negative 308,The court must not punish anybody who was forced to do a crime,Devarim 22:26,https://www.sefaria.org/Sefer_HaMitzvot%2C_Negative_Commandments.308?lang=bi
2026-09-06,572,Negative 309,A judge must not pity the murderer or assaulter at the trial,Devarim 19:13,https://www.sefaria.org/Sefer_HaMitzvot%2C_Negative_Commandments.309?lang=bi
2026-09-07,573,Negative 310,We are prohibited from keeping a sorcerer alive.,Vayikra 19:15,https://www.sefaria.org/Sefer_HaMitzvot%2C_Negative_Commandments.310?lang=bi
2026-09-07,574,Negative 311,"We are prohibited from a groom from leaving his home in order to be involved with one of the burdens for an entire year - not to go out to war, and not for anything besides it.",Vayikra 19:15,https://www.sefaria.org/Sefer_HaMitzvot%2C_Negative_Commandments.311?lang=bi
2026-09-08,575,Negative 312,We are prohibited from dissenting against those who are the masters of the tradition and against their derivations from the commandments through the [methods] of Torah.,Shemos 23:6,https://www.sefaria.org/Sefer_HaMitzvot%2C_Negative_Commandments.312?lang=bi
2026-09-08,576,Negative 313,"We are prohibited from adding to the Torah, both to what is written and to what is received.",Vayikra 19:15,https://www.sefaria.org/Sefer_HaMitzvot%2C_Negative_Commandments.313?lang=bi
2026-09-09,577,Negative 314,A judge must not pervert a case involving a convert or orphan,Devarim 24:17,https://www.sefaria.org/Sefer_HaMitzvot%2C_Negative_Commandments.314?lang=bi
2026-09-09,578,Negative 315,We are prohibited from cursing a judge.,Vayikra 19:15,https://www.sefaria.org/Sefer_HaMitzvot%2C_Negative_Commandments.315?lang=bi
2026-09-10,579,Negative 316,We are prohibited from cursing a <i>nassi</i> (elevated one).,Devarim 1:17,https://www.sefaria.org/Sefer_HaMitzvot%2C_Negative_Commandments.316?lang=bi
2026-09-10,580,Negative 317,We are prohibited from cursing any Israelite person.,Shemos 23:8,https://www.sefaria.org/Sefer_HaMitzvot%2C_Negative_Commandments.317?lang=bi
2026-09-11,581,Negative 318,Judges must not accept testimony unless both parties are present,Shemos 23:1,https://www.sefaria.org/Sefer_HaMitzvot%2C_Negative_Commandments.318?lang=bi
2026-09-11,582,Negative 319,Not to curse judges,Shemos 22:27,https://www.sefaria.org/Sefer_HaMitzvot%2C_Negative_Commandments.319?lang=bi
2026-09-12,583,Negative 320,Not to curse the head of state or leader of the Sanhedrin,Shemos 22:27,https://www.sefaria.org/Sefer_HaMitzvot%2C_Negative_Commandments.320?lang=bi
2026-09-12,584,Negative 321,We are prohibited from not walking outside of the city's perimeter on Shabbos.,Vayikra 19:14,https://www.sefaria.org/Sefer_HaMitzvot%2C_Negative_Commandments.321?lang=bi
2026-09-13,585,Negative 322,We are prohibited from enacting the punishments against the sinners and enforcing the law against them on the Shabbos day.,Vayikra 5:1,https://www.sefaria.org/Sefer_HaMitzvot%2C_Negative_Commandments.322?lang=bi
2026-09-13,586,Negative 323,We are prohibited from doing work on the the first day of pesach.,Devarim 13:15,https://www.sefaria.org/Sefer_HaMitzvot%2C_Negative_Commandments.323?lang=bi
2026-09-14,587,Negative 324,We are prohibited from doing work on the the seventh day of pesach.,Bamidbar 35:30,https://www.sefaria.org/Sefer_HaMitzvot%2C_Negative_Commandments.324?lang=bi
2026-09-14,588,Negative 325,We are prohibited from doing work on the day of atzeret (Shavuos).,Devarim 19:15,https://www.sefaria.org/Sefer_HaMitzvot%2C_Negative_Commandments.325?lang=bi
2026-09-15,589,Negative 326,We are prohibited from doing work on the day of Rosh Hashana.,Shemos 23:1,https://www.sefaria.org/Sefer_HaMitzvot%2C_Negative_Commandments.326?lang=bi
