Date,Sequential_Number,Mitzvah_Type_Number,Summary,Biblical_Source,Sefaria_Link
2026-01-25,123,Positive 109,"We are commanded that we immerse in the mikveh waters, and that we then become pure from one of the various types of impurities with which we have become impure.",Shemos 12:15,https://www.sefaria.org/Sefer_HaMitzvot%2C_Positive_Commandments.109?lang=bi
2026-01-25,124,Positive 110,We are commanded that the purification from <i>tzaraas</i> be according to the process written in Scripture (Vayikra 14).,Shemos 13:3,https://www.sefaria.org/Sefer_HaMitzvot%2C_Positive_Commandments.110?lang=bi
2026-01-26,125,Positive 111,We are commanded to remove the ashes from the altar.,Shemos 12:20,https://www.sefaria.org/Sefer_HaMitzvot%2C_Positive_Commandments.111?lang=bi
2026-01-26,126,Positive 112,"We are commanded that a <i>metzora</i> (a person with <i>tsaarat</i>) be known to all, such that people will separate from him.",Shemos 13:7,https://www.sefaria.org/Sefer_HaMitzvot%2C_Positive_Commandments.112?lang=bi
2026-01-27,127,Positive 113,"We are commanded to process the red heifer, so that its ashes be ready for one who needs it for purification from the impurity of a corpse as He said, ""and it shall be for the congregation of the Children of Israel"" (Bamidbar 19:9).",Shemos 12:19,https://www.sefaria.org/Sefer_HaMitzvot%2C_Positive_Commandments.113?lang=bi
2026-01-27,128,Positive 114,We are commanded to administer the law of human appraisals.,Shemos 12:18,https://www.sefaria.org/Sefer_HaMitzvot%2C_Positive_Commandments.114?lang=bi
2026-01-28,129,Positive 115,We are commanded with the law of animal appraisals.,Shemos 13:8,https://www.sefaria.org/Sefer_HaMitzvot%2C_Positive_Commandments.115?lang=bi
2026-01-28,130,Positive 116,We are commanded about house appraisals.,Bamidbar 29:1,https://www.sefaria.org/Sefer_HaMitzvot%2C_Positive_Commandments.116?lang=bi
2026-01-29,131,Positive 117,We are commanded about field appraisals.,Vayikra 23:42,https://www.sefaria.org/Sefer_HaMitzvot%2C_Positive_Commandments.117?lang=bi
2026-01-29,132,Positive 118,"We are commanded that anyone who benefits from consecrated property add a fifth; likewise if he eats consecrated food meaning if [a non-priest] ate from the priestly tithe inadvertently, he pays for what he ate or the measure of what he benefitted, with the addition of a fifth.",Vayikra 23:40,https://www.sefaria.org/Sefer_HaMitzvot%2C_Positive_Commandments.118?lang=bi
2026-01-30,133,Positive 119,We are commanded that the sapling of the fourth year be completely holy.,Shemos 30:13,https://www.sefaria.org/Sefer_HaMitzvot%2C_Positive_Commandments.119?lang=bi
2026-01-30,134,Positive 120,"We are commanded to leave over the corner of the produce, the trees and that which is similar to them.",Shemos 12:2,https://www.sefaria.org/Sefer_HaMitzvot%2C_Positive_Commandments.120?lang=bi
2026-01-31,135,Positive 121,We are commanded to leave over the gleanings.,Bamidbar 10:9,https://www.sefaria.org/Sefer_HaMitzvot%2C_Positive_Commandments.121?lang=bi
2026-01-31,136,Positive 122,To marry a wife by the means prescribed in the Torah (kiddushin),Devarim 24:1,https://www.sefaria.org/Sefer_HaMitzvot%2C_Positive_Commandments.122?lang=bi
2026-02-01,137,Positive 123,We are commanded to leave over that which is called <i>ollalot</i> (incomplete clusters) for the poor when we harvest the vineyard.,Devarim 23:18,https://www.sefaria.org/Sefer_HaMitzvot%2C_Positive_Commandments.123?lang=bi
2026-02-01,138,Positive 124,"We are commanded to leave over for the poor, that which falls and breaks off from the grapes when we harvest them.",Shemos 21:10,https://www.sefaria.org/Sefer_HaMitzvot%2C_Positive_Commandments.124?lang=bi
2026-02-02,139,Positive 125,We are commanded to extract the first-fruits and bring them to the Temple.,Bereishis 1:28,https://www.sefaria.org/Sefer_HaMitzvot%2C_Positive_Commandments.125?lang=bi
2026-02-02,140,Positive 126,We are commanded to extract the great (priestly) tithe (<i>terumah gedolah</i>).,Devarim 24:1,https://www.sefaria.org/Sefer_HaMitzvot%2C_Positive_Commandments.126?lang=bi
2026-02-03,141,Positive 127,We are commanded to extract the tithe from agricultural produce.,Devarim 24:4,https://www.sefaria.org/Sefer_HaMitzvot%2C_Positive_Commandments.127?lang=bi
2026-02-03,142,Positive 128,To do Yibum (marry childless brother's widow),Devarim 25:5,https://www.sefaria.org/Sefer_HaMitzvot%2C_Positive_Commandments.128?lang=bi
2026-02-04,143,Positive 129,We are commanded regarding the garments of the High Priest.,Devarim 25:9,https://www.sefaria.org/Sefer_HaMitzvot%2C_Positive_Commandments.129?lang=bi
2026-02-04,144,Positive 130,"We are commanded to extract the poor tithe every third year of the sabbatical [cycle], as well as the third year from every third year meaning the sixth year of the sabbatical [cycle].",Devarim 25:5,https://www.sefaria.org/Sefer_HaMitzvot%2C_Positive_Commandments.130?lang=bi
2026-02-05,145,Positive 131,"We are commanded to declare in front of Him the fulfillment of the regulations of the tithes and the priestly tithes; and to be clear from them also in speech, the same way we are clear from holding them back in deed.",Shemos 22:15-16,https://www.sefaria.org/Sefer_HaMitzvot%2C_Positive_Commandments.131?lang=bi
2026-02-05,146,Positive 132,"We are commanded to tell over His kindnesses that He benefited us and saved us and one begins with the topic of our father, Yaakov, and finishes with the toil of the Egyptians and their afflicting us to praise Him about all of this; and to request from Him to continue the blessing, at the time that one brings the first-fruits.",Devarim 22:29,https://www.sefaria.org/Sefer_HaMitzvot%2C_Positive_Commandments.132?lang=bi
2026-02-06,147,Positive 133,We are commanded to separate the loaf (<i>challah</i>)-tithe from our dough and to give it to the priest.,Devarim 22:29,https://www.sefaria.org/Sefer_HaMitzvot%2C_Positive_Commandments.133?lang=bi
2026-02-06,148,Positive 134,We are commanded to render ownerless all that grows from the ground during the sabbatical year and permit the growth of all of our lands to any person.,Devarim 22:19,https://www.sefaria.org/Sefer_HaMitzvot%2C_Positive_Commandments.134?lang=bi
2026-02-07,149,Positive 135,We are commanded to rest from any agricultural work on the seventh year.,Devarim 22:19,https://www.sefaria.org/Sefer_HaMitzvot%2C_Positive_Commandments.135?lang=bi
2026-02-07,150,Positive 136,"We are commanded to sanctify the fiftieth year that is to say, to cease working during it.",Bamidbar 5:30,https://www.sefaria.org/Sefer_HaMitzvot%2C_Positive_Commandments.136?lang=bi
2026-02-08,151,Positive 137,"We are commanded to blow the shofar on the tenth day of Tishrei of this year to announce the freedom of the slaves, and that every Jewish slave go out to freedom on the tenth day of Tishrei.",Bamidbar 5:15,https://www.sefaria.org/Sefer_HaMitzvot%2C_Positive_Commandments.137?lang=bi
2026-02-08,152,Positive 138,"We are commanded to return all the lands to their owners in this year, and that they go out from their buyers without [payment].",Bamidbar 5:15,https://www.sefaria.org/Sefer_HaMitzvot%2C_Positive_Commandments.138?lang=bi
2026-02-09,153,Positive 139,We are commanded that there be [the possibility of] redeeming lands sold within the city wall only until the end of a year.,Vayikra 18:7,https://www.sefaria.org/Sefer_HaMitzvot%2C_Positive_Commandments.139?lang=bi
2026-02-09,154,Positive 140,"We are commanded to count the years and the sabbatical cycles until the Jubilee year, once the land has been conquered and we have subdued it.",Vayikra 18:8,https://www.sefaria.org/Sefer_HaMitzvot%2C_Positive_Commandments.140?lang=bi
2026-02-10,155,Positive 141,We are commanded to release monies meaning all debts on the sabbatical year.,Vayikra 18:9,https://www.sefaria.org/Sefer_HaMitzvot%2C_Positive_Commandments.141?lang=bi
2026-02-10,156,Positive 142,"We are commanded to press the gentile and to force him to pay his debt, just as we have been commanded to pity the Jew and have been prohibited from pressing him.",Vayikra 18:11,https://www.sefaria.org/Sefer_HaMitzvot%2C_Positive_Commandments.142?lang=bi
2026-02-11,157,Positive 143,"We are commanded to give to the priest, the shoulder, the cheeks and the stomach from every sacrifice of pure animals that we slaughter.",Vayikra 18:10,https://www.sefaria.org/Sefer_HaMitzvot%2C_Positive_Commandments.143?lang=bi
2026-02-11,158,Positive 144,We are commanded to give the first shearing to the priest.,Vayikra 18:10,https://www.sefaria.org/Sefer_HaMitzvot%2C_Positive_Commandments.144?lang=bi
2026-02-12,159,Positive 145,We are commanded to administer the laws of dedications.,Vayikra 18:10,https://www.sefaria.org/Sefer_HaMitzvot%2C_Positive_Commandments.145?lang=bi
2026-02-12,160,Positive 146,"We are commanded to slaughter a beast, animal or bird and then to eat its meat; and that it only be permissible to eat their meat by slaughtering [it].",Vayikra 18:17,https://www.sefaria.org/Sefer_HaMitzvot%2C_Positive_Commandments.146?lang=bi
2026-02-13,161,Positive 147,Not to marry a woman and her son's daughter,Vayikra 18:17,https://www.sefaria.org/Sefer_HaMitzvot%2C_Positive_Commandments.147?lang=bi
2026-02-13,162,Positive 148,Not to marry a woman and her daughter's daughter,Vayikra 18:17,https://www.sefaria.org/Sefer_HaMitzvot%2C_Positive_Commandments.148?lang=bi
2026-02-14,163,Positive 149,We are commanded to check for the signs of beasts and animals that can be slaughtered and that is that they chew the cud and have split hooves and it is then permissible to eat them.,Vayikra 18:12,https://www.sefaria.org/Sefer_HaMitzvot%2C_Positive_Commandments.149?lang=bi
2026-02-14,164,Positive 150,"We are commanded to check for the signs of birds, such that only some of them are permissible.",Vayikra 18:13,https://www.sefaria.org/Sefer_HaMitzvot%2C_Positive_Commandments.150?lang=bi
2026-02-15,165,Positive 151,We are commanded to check for the signs of locusts as well.,Vayikra 18:14,https://www.sefaria.org/Sefer_HaMitzvot%2C_Positive_Commandments.151?lang=bi
2026-02-15,166,Positive 152,"We are commanded to check for the signs of [permissible] fish, which are written [in the Torah].",Vayikra 18:15,https://www.sefaria.org/Sefer_HaMitzvot%2C_Positive_Commandments.152?lang=bi
2026-02-16,167,Positive 153,"We are commanded to sanctify (proclaim) the months (in other versions, and to calculate the months) and years.",Vayikra 18:16,https://www.sefaria.org/Sefer_HaMitzvot%2C_Positive_Commandments.153?lang=bi
2026-02-16,168,Positive 154,We are commanded to rest on Shabbos.,Vayikra 18:18,https://www.sefaria.org/Sefer_HaMitzvot%2C_Positive_Commandments.154?lang=bi
2026-02-17,169,Positive 155,We are commanded to sanctify the Shabbos and to say things at its beginning and its culmination.,Vayikra 18:23,https://www.sefaria.org/Sefer_HaMitzvot%2C_Positive_Commandments.155?lang=bi
2026-02-17,170,Positive 156,We are commanded to destroy chametz from our homes on the fourteenth day of Nissan.,Vayikra 18:23,https://www.sefaria.org/Sefer_HaMitzvot%2C_Positive_Commandments.156?lang=bi
2026-02-18,171,Positive 157,We are commanded to tell about the Shemos from Egypt on the night of the fifteenth of Nissan at the beginning of the night according to the speaker's linguistic abilities.,Vayikra 18:22,https://www.sefaria.org/Sefer_HaMitzvot%2C_Positive_Commandments.157?lang=bi
2026-02-18,172,Positive 158,We are commanded to eat matzah on the night of the fifteenth of Nissan whether there is a Pesach lamb or not.,Vayikra 18:7,https://www.sefaria.org/Sefer_HaMitzvot%2C_Positive_Commandments.158?lang=bi
2026-02-19,173,Positive 159,We are commanded to rest on the first day of Pesach.,Vayikra 18:14,https://www.sefaria.org/Sefer_HaMitzvot%2C_Positive_Commandments.159?lang=bi
2026-02-19,174,Positive 160,We are commanded to rest from work on the seventh [day] of Pesach.,Vayikra 18:20,https://www.sefaria.org/Sefer_HaMitzvot%2C_Positive_Commandments.160?lang=bi
2026-02-20,175,Positive 161,We are commanded to count forty-nine days from the harvesting of the omer.,Vayikra 18:19,https://www.sefaria.org/Sefer_HaMitzvot%2C_Positive_Commandments.161?lang=bi
2026-02-20,176,Positive 162,We are commanded to rest from work on the day of <i>Atzeret</i> (Shavuos).,Devarim 7:3,https://www.sefaria.org/Sefer_HaMitzvot%2C_Positive_Commandments.162?lang=bi
2026-02-21,177,Positive 163,We are commanded to rest from work on the First of Tishrei.,Devarim 23:4,https://www.sefaria.org/Sefer_HaMitzvot%2C_Positive_Commandments.163?lang=bi
2026-02-21,178,Positive 164,We are commanded to fast on the tenth day of Tishrei.,Devarim 23:8-9,https://www.sefaria.org/Sefer_HaMitzvot%2C_Positive_Commandments.164?lang=bi
2026-02-22,179,Positive 165,We are commanded to rest from work and [certain] actions on Yom Kippur.,Devarim 23:8-9,https://www.sefaria.org/Sefer_HaMitzvot%2C_Positive_Commandments.165?lang=bi
2026-02-22,180,Positive 166,We are commanded to rest from work on the first day of Sukkos.,Devarim 23:3,https://www.sefaria.org/Sefer_HaMitzvot%2C_Positive_Commandments.166?lang=bi
2026-02-23,181,Positive 167,We are commanded to rest from work on the eighth [day] of the holiday of Sukkos.,Devarim 23:2,https://www.sefaria.org/Sefer_HaMitzvot%2C_Positive_Commandments.167?lang=bi
2026-02-23,182,Positive 168,Not to castrate any male (including animals),Vayikra 22:24,https://www.sefaria.org/Sefer_HaMitzvot%2C_Positive_Commandments.168?lang=bi
2026-02-24,183,Positive 169,We are commanded to hold the lulav and to rejoice in front of the Lord seven days.,Vayikra 21:14,https://www.sefaria.org/Sefer_HaMitzvot%2C_Positive_Commandments.169?lang=bi
2026-02-24,184,Positive 170,We are commanded to listen to the sound of the shofar on the first day of Tishrei.,Vayikra 21:14,https://www.sefaria.org/Sefer_HaMitzvot%2C_Positive_Commandments.170?lang=bi
2026-02-25,185,Positive 171,We are commanded to give over a half shekel-coin each year.,Vayikra 21:13,https://www.sefaria.org/Sefer_HaMitzvot%2C_Positive_Commandments.171?lang=bi
2026-02-25,186,Positive 172,"We are commanded to listen to all of the prophets, to do all that he commands even against a commandment or a group of these commandments.",Vayikra 21:7,https://www.sefaria.org/Sefer_HaMitzvot%2C_Positive_Commandments.172?lang=bi
2026-02-26,187,Positive 173,We are commanded to appoint a king upon us [that] he gather all of our nation and lead us.,Vayikra 21:7,https://www.sefaria.org/Sefer_HaMitzvot%2C_Positive_Commandments.173?lang=bi
2026-02-26,188,Positive 174,"We are commanded to listen to the Great Court and to do everything that they command us, to forbid and to permit.",Vayikra 21:7,https://www.sefaria.org/Sefer_HaMitzvot%2C_Positive_Commandments.174?lang=bi
2026-02-27,189,Positive 175,We are commanded to follow the majority when there is a disagreement among the sages about any of the laws of the Torah.,Vayikra 18:6,https://www.sefaria.org/Sefer_HaMitzvot%2C_Positive_Commandments.175?lang=bi
2026-02-27,190,Positive 176,We are commanded to appoint judges and officers to force the implementation of the Torah's commandments and to bring those inclining away from the true path back towards it.,Vayikra 11:2,https://www.sefaria.org/Sefer_HaMitzvot%2C_Positive_Commandments.176?lang=bi
2026-02-28,191,Positive 177,We are commanded in this positive mitzvah.,Devarim 14:11,https://www.sefaria.org/Sefer_HaMitzvot%2C_Positive_Commandments.177?lang=bi
2026-02-28,192,Positive 178,We are commanded to testify in court about everything that we know.,Vayikra 11:9,https://www.sefaria.org/Sefer_HaMitzvot%2C_Positive_Commandments.178?lang=bi
2026-03-01,193,Positive 179,We are commanded to investigate the testimony and to inquire [about] it well; and afterwards we judge the case and reach the truth.,Vayikra 11:21,https://www.sefaria.org/Sefer_HaMitzvot%2C_Positive_Commandments.179?lang=bi
2026-03-01,194,Positive 180,We are commanded to render witnesses that testify falsely liable for the punishment that they thought to bring about with their testimony.,Vayikra 11:4,https://www.sefaria.org/Sefer_HaMitzvot%2C_Positive_Commandments.180?lang=bi
2026-03-02,195,Positive 181,We are commanded to behead a calf according to its commandment when a corpse is found in the field and it is not known who killed him.,Vayikra 11:13,https://www.sefaria.org/Sefer_HaMitzvot%2C_Positive_Commandments.181?lang=bi
2026-03-02,196,Positive 182,"We are commanded to prepare six cities of refuge, such that they be ready for the accidental manslaughterer, that a path to them be fixed, that it be straightened and that nothing be left that would impede the fugitive from running [to them].",Vayikra 11:11,https://www.sefaria.org/Sefer_HaMitzvot%2C_Positive_Commandments.182?lang=bi
2026-03-03,197,Positive 183,"We are commanded to give cities to the Levites to dwell, since they do not have a portion and inheritance in the Land.",Devarim 14:19,https://www.sefaria.org/Sefer_HaMitzvot%2C_Positive_Commandments.183?lang=bi
2026-03-03,198,Positive 184,We are commanded to remove obstacles and dangers from all of our inhabitations.,Vayikra 11:41,https://www.sefaria.org/Sefer_HaMitzvot%2C_Positive_Commandments.184?lang=bi
2026-03-04,199,Positive 185,"We are commanded to destroy idolatry and all of its houses with all types of destruction, annihilation, breaking, burning, demolishing and cutting every type according to what will be most enhanced and quickest in the destruction.",Vayikra 11:44,https://www.sefaria.org/Sefer_HaMitzvot%2C_Positive_Commandments.185?lang=bi
2026-03-04,200,Positive 186,We are commanded to kill all the people of a condemned city (<i>ir hanidachat</i>) and to burn the city with everything that is in it.,Vayikra 11:42,https://www.sefaria.org/Sefer_HaMitzvot%2C_Positive_Commandments.186?lang=bi
2026-03-05,201,Positive 187,"We are commanded to kill the seven nations that dwelled in the Land of Canaan and to destroy them, since they are the root of idolatry and its first base.",Vayikra 11:43,https://www.sefaria.org/Sefer_HaMitzvot%2C_Positive_Commandments.187?lang=bi
2026-03-05,202,Positive 188,"We are commanded to exclusively cut off the seed of Amalek males, females, adults and children from among the rest of the descendants of Esav.",Devarim 14:21,https://www.sefaria.org/Sefer_HaMitzvot%2C_Positive_Commandments.188?lang=bi
2026-03-06,203,Positive 189,"We are commanded to remember what Amalek did to us in its coming forward to do us evil, to hate it at all times, to arouse the spirits with statements to fight with it and to make the nation alacritous to hate it such that the commandment not be forgotten with [the passing of] so much time.",Shemos 21:28,https://www.sefaria.org/Sefer_HaMitzvot%2C_Positive_Commandments.189?lang=bi
2026-03-06,204,Positive 190,We are commanded the law that He gave to us in a war with the other nations; and that is called an optional war.,Shemos 22:30,https://www.sefaria.org/Sefer_HaMitzvot%2C_Positive_Commandments.190?lang=bi
2026-03-07,205,Positive 191,We are commanded to appoint a priest that rebukes the people with the rebukes [needed for a] war and recalls whoever is not fit to fight whether from weakness [or because] his thoughts will be on a matter that will lead to a lack of courage in war and these are the three things explained by Scripture.,Devarim 12:23,https://www.sefaria.org/Sefer_HaMitzvot%2C_Positive_Commandments.191?lang=bi
2026-03-07,206,Positive 192,"We are commanded that when our soldiers go out to war, we prepare them a path outside of the camps, such that the people go out and a man not do his needs everywhere and between the dwellings, like the [other] nations do.",Vayikra 3:17,https://www.sefaria.org/Sefer_HaMitzvot%2C_Positive_Commandments.192?lang=bi
2026-03-08,207,Positive 193,We are commanded that there be a digging tool together with the other tools of war with each one of the men of war; so as to dig with it in the place that he defecates on that path that is designated for this.,Vayikra 3:17,https://www.sefaria.org/Sefer_HaMitzvot%2C_Positive_Commandments.193?lang=bi
2026-03-08,208,Positive 194,"We are commanded to return the stolen item itself, if it is still remaining as itself with the addition of a fifth if he swore [about it] or to give its value, if it was transformed.",Bereishis. 32:33,https://www.sefaria.org/Sefer_HaMitzvot%2C_Positive_Commandments.194?lang=bi
2026-03-09,209,Positive 195,We are commanded to give charity (<i>tzedekah</i>) and to strengthen the weak and to ease [their situation].,Shemos 23:19,https://www.sefaria.org/Sefer_HaMitzvot%2C_Positive_Commandments.195?lang=bi
2026-03-09,210,Positive 196,"We are commanded to reward a Hebrew (Jewish) slave when he goes free, and not to have him leave [his owner's domain] empty-handed.",Shemos 34:26,https://www.sefaria.org/Sefer_HaMitzvot%2C_Positive_Commandments.196?lang=bi
2026-03-10,211,Positive 197,"We are commanded to lend to the poor, to lighten his poverty from upon him and to ease [his condition].",Vayikra 23:14,https://www.sefaria.org/Sefer_HaMitzvot%2C_Positive_Commandments.197?lang=bi
2026-03-10,212,Positive 198,We are commanded to demand interest from idolaters.,Vayikra 23:14,https://www.sefaria.org/Sefer_HaMitzvot%2C_Positive_Commandments.198?lang=bi
2026-03-11,213,Positive 199,We are commanded to return the surety to its Jewish owner at the time that he has a need for it: If the surety is from that which he needs during the day such as tools of his craft or his activity he returns it to him during the day and holds it in surety at night; and if it is from that which he needs at night such as a pillow or a blanket he returns it to him at night and holds it in surety during the day.,Vayikra 23:14,https://www.sefaria.org/Sefer_HaMitzvot%2C_Positive_Commandments.199?lang=bi
2026-03-11,214,Positive 200,"We are commanded to give the wage of an employee on its day, and not to delay it to another day.",Vayikra 19:23,https://www.sefaria.org/Sefer_HaMitzvot%2C_Positive_Commandments.200?lang=bi
2026-03-12,215,Positive 201,Not to eat diverse seeds planted in a vineyard,Devarim 22:9,https://www.sefaria.org/Sefer_HaMitzvot%2C_Positive_Commandments.201?lang=bi
2026-03-12,216,Positive 202,We are commanded to unload the load from upon an animal when it gets tired from its load upon the way.,Vayikra 22:15,https://www.sefaria.org/Sefer_HaMitzvot%2C_Positive_Commandments.202?lang=bi
2026-03-13,217,Positive 203,"We are commanded to raise up the load upon an animal or a person when he is alone, after someone besides us has put it down.",Devarim 32:38,https://www.sefaria.org/Sefer_HaMitzvot%2C_Positive_Commandments.203?lang=bi
2026-03-13,218,Positive 204,We are commanded to return a lost object to its owners.,Devarim 12:21,https://www.sefaria.org/Sefer_HaMitzvot%2C_Positive_Commandments.204?lang=bi
2026-03-14,219,Positive 205,"We are commanded to rebuke a sinner, or one who wants to sin, and to prevent him from it with words of rebuke.",Vayikra 22:28,https://www.sefaria.org/Sefer_HaMitzvot%2C_Positive_Commandments.205?lang=bi
2026-03-14,220,Positive 206,To cover the blood (of a slaughtered beast or fowl) with earth,Vayikra 17:13,https://www.sefaria.org/Sefer_HaMitzvot%2C_Positive_Commandments.206?lang=bi
2026-03-15,221,Positive 207,We are commanded to love converts.,Devarim 22:6,https://www.sefaria.org/Sefer_HaMitzvot%2C_Positive_Commandments.207?lang=bi
2026-03-15,222,Positive 208,"We are commanded to justify the leveler, the scales, the weights and the measures; and to maximize their exactness.",Devarim 22:7,https://www.sefaria.org/Sefer_HaMitzvot%2C_Positive_Commandments.208?lang=bi
2026-03-16,223,Positive 209,Not to swear falsely in G‑d's Name,Vayikra 19:12,https://www.sefaria.org/Sefer_HaMitzvot%2C_Positive_Commandments.209?lang=bi
2026-03-16,224,Positive 210,Not to take G‑d's Name in vain,Shemos 20:7,https://www.sefaria.org/Sefer_HaMitzvot%2C_Positive_Commandments.210?lang=bi
2026-03-17,225,Positive 211,Not to deny possession of something entrusted to you,Vayikra 19:11,https://www.sefaria.org/Sefer_HaMitzvot%2C_Positive_Commandments.211?lang=bi
2026-03-17,226,Positive 212,"We are commanded to be fruitful and multiply, with the intention of preserving the species.",Vayikra 19:11,https://www.sefaria.org/Sefer_HaMitzvot%2C_Positive_Commandments.212?lang=bi
2026-03-18,227,Positive 213,We are commanded to marry with <i>kiddushin</i>: To give something into the hand of the woman; through a contract; or through sexual intercourse.,Devarim 10:20,https://www.sefaria.org/Sefer_HaMitzvot%2C_Positive_Commandments.213?lang=bi
2026-03-18,228,Positive 214,To fulfill what was uttered and to do what was avowed,Devarim 23:24,https://www.sefaria.org/Sefer_HaMitzvot%2C_Positive_Commandments.214?lang=bi
2026-03-19,229,Positive 215,We are commanded to circumcise a boy.,Bamidbar 30:3,https://www.sefaria.org/Sefer_HaMitzvot%2C_Positive_Commandments.215?lang=bi
2026-03-19,230,Positive 216,We are commanded that a <i>yavam</i> (levirate husband) marry the wife of his brother when [the latter] dies without leaving offspring.,Bamidbar 30:3,https://www.sefaria.org/Sefer_HaMitzvot%2C_Positive_Commandments.216?lang=bi
2026-03-20,231,Positive 217,We are commanded that a <i>yevamah</i> (levirate wife) release her <i>yavam</i> if he does not marry her.,Bamidbar 6:5,https://www.sefaria.org/Sefer_HaMitzvot%2C_Positive_Commandments.217?lang=bi
2026-03-20,232,Positive 218,We are commanded that a rapist marry the woman he raped.,Bamidbar 6:5,https://www.sefaria.org/Sefer_HaMitzvot%2C_Positive_Commandments.218?lang=bi
2026-03-21,233,Positive 219,"We are commanded the law of the one who puts out a bad name meaning to say, that He commanded us to give him lashes and that she be his wife.",Bamidbar 6:3,https://www.sefaria.org/Sefer_HaMitzvot%2C_Positive_Commandments.219?lang=bi
2026-03-21,234,Positive 220,We are commanded about the law of the seducer.,Bamidbar 6:3,https://www.sefaria.org/Sefer_HaMitzvot%2C_Positive_Commandments.220?lang=bi
